source_with_markdown,source_without_markdown,target_without_markdown,target_with_markdown
"This part of my morning routine was established more recently and is a creative process. It’s an activity of writing 750 words (around 3 pages) each morning. It’s not blogging or anything that I will ever release to the world. It’s a stream of consciousness of whatever is on my mind, essentially a brain dump on ideas for business, life, and other decisions. Whatever I want to clear my mind of, It gets my brain working and thinking more creatively.","This part of my morning routine was established more recently and is a creative process. It’s an activity of writing 750 words (around 3 pages) each morning. It’s not blogging or anything that I will ever release to the world. It’s a stream of consciousness of whatever is on my mind, essentially a brain dump on ideas for business, life, and other decisions. Whatever I want to clear my mind of, It gets my brain working and thinking more creatively.",This part of my morning routine was established more recently and is a creative process. It’s not blogging or anything that I will ever release to the world. It gets my brain working and thinking more creatively.,This part of my morning routine was established more recently and is a creative process. It’s not blogging or anything that I will ever release to the world. It gets my brain working and thinking more creatively.
"Each morning I write down my goals. First, I write down a long-term goal that I’m working towards. I write this down each day to keep me mindful of my direction so that I don’t go off track. Then, I write down the day’s targets, which are what 3 things I need to accomplish to move me further toward my long-term goal. I usually have my 13-Week Roadmap planned ahead of time that has my goals broken down with a timeline. I’ll delve into this process in another post, but essentially it’s a planning structure so that I know what I should be working on for 3 months at a time. Interested in learning about this? [Let me know](http://littlemight.com).","Each morning I write down my goals. First, I write down a long-term goal that I’m working towards. I write this down each day to keep me mindful of my direction so that I don’t go off track. Then, I write down the day’s targets, which are what 3 things I need to accomplish to move me further toward my long-term goal. I usually have my 13-Week Roadmap planned ahead of time that has my goals broken down with a timeline. I’ll delve into this process in another post, but essentially it’s a planning structure so that I know what I should be working on for 3 months at a time. Interested in learning about this? Let me know.",Each morning I write down my goals to keep me mindful of my direction. I usually have my 13-Week Roadmap planned ahead of time.,Each morning I write down my goals to keep me mindful of my direction. I usually have my 13-Week Roadmap planned ahead of time.
"I break down my day in 30 minute increments, enter any calls or appointments I have, and then schedule out my tasks for the day. I always put the most important (coincidentally usually the least enjoyable) first so that I ensure it gets done. I try to never book any meetings or appointments until late in the afternoon if I can help it because my mornings are my sacred hours of peak productivity.

**Then I begin working.**

I don’t look at my phone, email, facebook, or twitter until after I’ve completed that first big task of my day. I pause my inboxes the night before (using [inbox pause](http://inboxpause.com/)) so that, in the morning, if I do need to send out any emails I can do so without being bombarded with any incoming mail. **Remember, email is someone else’s request of your time. Prioritize your goals and tasks first before looking at email so you don’t go into reactive mode as opposed to proactive mode.**","I break down my day in 30 minute increments, enter any calls or appointments I have, and then schedule out my tasks for the day. I always put the most important (coincidentally usually the least enjoyable) first so that I ensure it gets done. I try to never book any meetings or appointments until late in the afternoon if I can help it because my mornings are my sacred hours of peak productivity. Then I begin working. I don’t look at my phone, email, facebook, or twitter until after I’ve completed that first big task of my day. I pause my inboxes the night before (using inbox pause) so that, in the morning, if I do need to send out any emails I can do so without being bombarded with any incoming mail. Remember, email is someone else’s request of your time. Prioritize your goals and tasks first before looking at email so you don’t go into reactive mode as opposed to proactive mode.","I break down my day in 30 minute increments, enter any calls or appointments I have, and then schedule out my tasks for the day. I try to never book any meetings or appointments until late in the afternoon if I can help it.","I break down my day in 30 minute increments, enter any calls or appointments I have, and then schedule out my tasks for the day. I try to never book any meetings or appointments until late in the afternoon if I can help it."
"My morning routine takes just over an hour. I can’t stress enough to you the importance of a great morning routine, as it will set you up for a successful day — and life. With that said, what I do isn’t for everyone. I experimented with a few different things and figured out what worked for me. You should do the same. Soon you’ll know what things work for you, and you’ll enjoy starting your day.

**I’d love to hear about your morning routine if you have one. What does the first hour of your day look like?**

_Cathryn Lavery is a serial entrepreneur dedicated to helping others become their Best Self._

**Want to hear from Cathryn, check out her** [**YouTube Channel LittleMight**](http://littlemight.com)**; business, productivity and leadership ideas to empower creators to change the world.**","My morning routine takes just over an hour. I can’t stress enough to you the importance of a great morning routine, as it will set you up for a successful day — and life. With that said, what I do isn’t for everyone. I experimented with a few different things and figured out what worked for me. You should do the same. Soon you’ll know what things work for you, and you’ll enjoy starting your day. I’d love to hear about your morning routine if you have one. What does the first hour of your day look like? Cathryn Lavery is a serial entrepreneur dedicated to helping others become their Best Self. Want to hear from Cathryn, check out her YouTube Channel LittleMight; business, productivity and leadership ideas to empower creators to change the world.",Cathryn Lavery is a serial entrepreneur dedicated to helping others become their Best Self.,"_Cathryn Lavery is a serial entrepreneur dedicated to helping others become their Best Self._ **Want to hear from Cathryn, check out her** [**YouTube Channel LittleMight**](http://littlemight.com)**; business, productivity and leadership ideas to empower creators to change the world.**"
"_If you dig this article, please hit recommend below. Thanks! :)_","If you dig this article, please hit recommend below. Thanks! :)","If you dig this article, please hit recommend below.","_If you dig this article, please hit recommend below._"
"Of course, I am trivializing what Instagram is to many people. It’s a beautifully executed app that enables the creation and enjoyment of art, as well as human connection, which is often a good thing. But my rant had very little to do with it (or with Twitter). My rant was the result of increasing frustration with the one-dimensionality that those who report on, invest in, and build consumer Internet services talk about success.","Of course, I am trivializing what Instagram is to many people. It’s a beautifully executed app that enables the creation and enjoyment of art, as well as human connection, which is often a good thing. But my rant had very little to do with it (or with Twitter). My rant was the result of increasing frustration with the one-dimensionality that those who report on, invest in, and build consumer Internet services talk about success."," Instagram is a beautifully executed app that enables the creation and enjoyment of art, as well as human connection.","Instagram is a beautifully executed app that enables the creation and enjoyment of art, as well as human connection."
"Ask any junior high student which rectangle is bigger, one that is three inches wide or one that is two-and-a-half inches wide, and they’ll tell you it’s a nonsensical question unless they have more information — specifically, the height.","Ask any junior high student which rectangle is bigger, one that is three inches wide or one that is two-and-a-half inches wide, and they’ll tell you it’s a nonsensical question unless they have more information — specifically, the height.","Ask any junior high student which rectangle is bigger, one is three inches wide or one that is two-and-a-half inches wide.","Ask any junior high student which rectangle is bigger, one is three inches wide or one that is two-and-a-half inches wide, and they’ll tell you it does not make sense until they know the height."
"And yet, we literally say one company or service is “bigger” based on a single number — specifically, number of people who have “used” it in the last 30 days. Even without getting into how “use” is defined, this is dumb.

In the recent Instagram/Twitter case, [Will Oremus’s piece in Slate](http://www.slate.com/blogs/future_tense/2014/12/10/instagram_hits_300_million_users_bigger_than_twitter_not_really.html) is the one I saw that didn’t just regurgitate the “bigger” headline. He does a great job of explaining why it’s not that simple. It’s worth a read, but the summary is this:","And yet, we literally say one company or service is “bigger” based on a single number — specifically, number of people who have “used” it in the last 30 days. Even without getting into how “use” is defined, this is dumb. In the recent Instagram/Twitter case, Will Oremus’s piece in Slate is the one I saw that didn’t just regurgitate the “bigger” headline. He does a great job of explaining why it’s not that simple. It’s worth a read, but the summary is this:"," One company or service is ""bigger"" based on a single number of people who have used it in the last 30 days. Even without getting into how ‘use’ is defined, this is dumb."," One company or service is ""bigger"" based on a single number of people who have used it in the last 30 days. Even without getting into how ‘use’ is defined, this is dumb."
"**Medium had its biggest week ever last week** — or so we might claim. By number of unique visitors to medium.com, we blew it out of the park. The main driver was a highly viral post that blew up (mostly on Facebook). However, the vast majority of those visitors stayed a fraction of what our average visitor stays, and they read hardly anything.

That’s why, internally, [our top-line metric is “TTR,”](https://medium.com/data-lab/mediums-metric-that-matters-total-time-reading-86c4970837d5) which stands for _total time reading._ It’s an imperfect measure of time people spend on story pages. We think this is a better estimate of whether people are actually getting value out of Medium. By TTR, last week was still big, but we had 50% more TTR during a week in early October when we had 60% as many unique visitors (i.e., there was way more actual reading per visit).","Medium had its biggest week ever last week — or so we might claim. By number of unique visitors to medium.com, we blew it out of the park. The main driver was a highly viral post that blew up (mostly on Facebook). However, the vast majority of those visitors stayed a fraction of what our average visitor stays, and they read hardly anything. That’s why, internally, our top-line metric is “TTR,” which stands for total time reading. It’s an imperfect measure of time people spend on story pages. We think this is a better estimate of whether people are actually getting value out of Medium. By TTR, last week was still big, but we had 50% more TTR during a week in early October when we had 60% as many unique visitors (i.e., there was way more actual reading per visit).",Medium.com had its biggest week ever last week. The main driver was a highly viral post that blew up (mostly on Facebook),**Medium.com had its biggest week ever last week.** The main driver was a highly viral post that blew up (mostly on Facebook)
[Mat Honan’s excellent _Wired_ article](http://www.wired.com/2014/12/new-media-2/) about the state of new media today accurately points out that everyone is in a “war for attention.” But it uses unique visitors as the way to compare how different outlets are doing in this war:,Mat Honan’s excellent Wired article about the state of new media today accurately points out that everyone is in a “war for attention.” But it uses unique visitors as the way to compare how different outlets are doing in this war:,Mat Honan’s excellent Wired article about the state of new media accurately points out that everyone is in a ‘war for attention’,[Mat Honan’s excellent _Wired_ article](http://www.wired.com/2014/12/new-media-2/) about the state of new media accurately points out that everyone is in a ‘war for attention’
"By this metric (misleadingly labeled “readership”), Buzzfeed is “bigger” than _The New York Times._ But that’s the exact same metric that would tell us last week was bigger for Medium than that week in October. Even if _all_ we care about is attention — not any other value that may be important— this doesn’t tell us much. _Maybe_ BuzzFeed gets more attention, total, than _The Times_. But we should stop purporting that one-dimensional graphs like this tell us that.","By this metric (misleadingly labeled “readership”), Buzzfeed is “bigger” than The New York Times. But that’s the exact same metric that would tell us last week was bigger for Medium than that week in October. Even if all we care about is attention — not any other value that may be important— this doesn’t tell us much. Maybe BuzzFeed gets more attention, total, than The Times. But we should stop purporting that one-dimensional graphs like this tell us that.","Buzzfeed is “bigger’ than The New York Times, but that’s the exact same metric that would tell us last week was bigger for Medium. Even if all we care about is attention, this doesn’t tell us much.","Buzzfeed is “bigger’ than _The New York Times_, but that’s the exact same metric that would tell us last week was bigger for Medium. Even if _all_ we care about is attention, this doesn’t tell us much."
"**More grains of salt:** The chart above — and a lot of the comparisons you read in the press about web site traffic — are based on Comscore’s numbers and only count U.S. users. Two big problems with this: 1) Most site operators will tell you their numbers vary greatly from Comscore’s. The smaller a site is, the more likely this is true (due to their sampling method). Although, Comscore will tell you that’s because they filter out duplicate users. 2) A small portion of total Internet users are in the U.S. Every site is global — but to very different degrees. So without a disclaimer that we’re only interested in the U.S., only showing U.S. numbers could be highly misleading.

Lastly, it’s not clear whether Comscore’s numbers include app traffic. I know they track app usage to some extent, but are they counting all of NYT’s apps in the above chart (or Buzzfeed’s)? (Leave a note here if you know.)","More grains of salt: The chart above — and a lot of the comparisons you read in the press about web site traffic — are based on Comscore’s numbers and only count U.S. users. Two big problems with this: 1) Most site operators will tell you their numbers vary greatly from Comscore’s. The smaller a site is, the more likely this is true (due to their sampling method). Although, Comscore will tell you that’s because they filter out duplicate users. 2) A small portion of total Internet users are in the U.S. Every site is global — but to very different degrees. So without a disclaimer that we’re only interested in the U.S., only showing U.S. numbers could be highly misleading. Lastly, it’s not clear whether Comscore’s numbers include app traffic. I know they track app usage to some extent, but are they counting all of NYT’s apps in the above chart (or Buzzfeed’s)? (Leave a note here if you know.)",A small portion of total Internet users are in the U.S. Every site is global — but to very different degrees.,A small portion of total Internet users are in the U.S. Every site is global — but to very different degrees.
"**We pay more attention to time** spent reading than number of visitors at Medium because, in a world of infinite content — where there are a million shiny attention-grabbing objects a touch away and notifications coming in constantly — it’s meaningful when someone is actually _spending_ time. After all, for a currency to be valuable, it has to be scarce. And while the amount of attention people are willing to give to media and the Internet in general has skyrocketed — largely due to having a screen and connection with them everywhere — it eventually is finite.

We’re not alone in this view. Chartbeat’s Tony Haile has done a great job of [promoting the idea of an “Attention Web”](http://time.com/12933/what-you-think-you-know-about-the-web-is-wrong/) (as opposed to the “Click Web”). He’s hopeful a shift to measuring attention will improve the web:","We pay more attention to time spent reading than number of visitors at Medium because, in a world of infinite content — where there are a million shiny attention-grabbing objects a touch away and notifications coming in constantly — it’s meaningful when someone is actually spending time. After all, for a currency to be valuable, it has to be scarce. And while the amount of attention people are willing to give to media and the Internet in general has skyrocketed — largely due to having a screen and connection with them everywhere — it eventually is finite. We’re not alone in this view. Chartbeat’s Tony Haile has done a great job of promoting the idea of an “Attention Web” (as opposed to the “Click Web”). He’s hopeful a shift to measuring attention will improve the web:",The amount of attention people are willing to give to media and the Internet has skyrocketed. Chartbeat’s Tony Haile has done a great job of promoting the idea of an ‘Attention Web’ (as opposed to the “Click Web”),The amount of attention people are willing to give to media and the Internet has skyrocketed. Chartbeat’s Tony Haile has done a great job of promoting the idea of an [“Attention Web”](http://time.com/12933/what-you-think-you-know-about-the-web-is-wrong/) (as opposed to the “Click Web”).
[Upworthy is also beating the time-means-quality drum](http://www.niemanlab.org/2014/02/upworthy-has-a-new-way-of-measuring-engagement/):,Upworthy is also beating the time-means-quality drum:,Upworthy is also beating the time-means-quality drum.,[Upworthy is also beating the time-means-quality drum](http://www.niemanlab.org/2014/02/upworthy-has-a-new-way-of-measuring-engagement/):
"And in that Wired article, they mention why time is more valuable if you’re in the ad business:","And in that Wired article, they mention why time is more valuable if you’re in the ad business:",Wired article: Time is more valuable if you're in the ad business.,The Wired article mentions why time is more valuable if you're in the ad business.
"**The problem with time,** though, is it’s not actually measuring value. It’s measuring cost as a _proxy_ for value.

Advertisers don’t really want your time — they want to make an impression on your mind, consciously or subconsciously (and, ultimately, your money).

As the writer of this piece, I don’t really want your time — I want to make an impression on how you think. If my rhetorical skills let me do that in less time (for me and you), all the better.

At Medium, we don’t really want anyone’s time. We want to create a platform that enables people to make an impression on others. To make them think. To change their minds. To teach them something or connect emotionally. It’s hard to measure any of that.","The problem with time, though, is it’s not actually measuring value. It’s measuring cost as a proxy for value. Advertisers don’t really want your time — they want to make an impression on your mind, consciously or subconsciously (and, ultimately, your money). As the writer of this piece, I don’t really want your time — I want to make an impression on how you think. If my rhetorical skills let me do that in less time (for me and you), all the better. At Medium, we don’t really want anyone’s time. We want to create a platform that enables people to make an impression on others. To make them think. To change their minds. To teach them something or connect emotionally. It’s hard to measure any of that.","Advertisers don’t really want your time — they want to make an impression on your mind, consciously or subconsciously (and, ultimately, your money) As the writer of this piece, I don”t really wants your time, I want to","Advertisers don’t really want your time — they want to make an impression on your mind, consciously or subconsciously (and, ultimately, your money)."
"**In the early days at Google,** I remember [the (crayon) chart on the wall](http://www.fastcompany.com/46507/between-lines) was number of queries. This seemed like a very sensible measure of value. And, in fact, there was an emphasis on taking as _little_ of people’s time as possible. If your service is a utility, as opposed to media, that’s probably a good goal.

(Twitter is as much utility as media and part of its benefit is being incredibly concise — plus, a lot of its purpose, like Google, is to point people off to other places. So optimizing for time spent probably wouldn’t make sense.)","In the early days at Google, I remember the (crayon) chart on the wall was number of queries. This seemed like a very sensible measure of value. And, in fact, there was an emphasis on taking as little of people’s time as possible. If your service is a utility, as opposed to media, that’s probably a good goal. (Twitter is as much utility as media and part of its benefit is being incredibly concise — plus, a lot of its purpose, like Google, is to point people off to other places. So optimizing for time spent probably wouldn’t make sense.)","In the early days of Google, there was an emphasis on taking as little of people’s time as possible. If your service is a utility, as opposed to media, that's probably a good goal.","**In the early days of Google,** there was an emphasis on taking as little of people’s time as possible. If your service is a utility, as opposed to media, that's probably a good goal."
"If you look at the other best tech company there is — Apple — it’s also clear they are not optimizing for number of people using their products. While network effects (and revenue) mean that they clearly care about that, they’ve built the most valuable company on the planet by focusing on building the best product possible — in fact, one of their strategies is building an integrated set of products and selling as many of them as possible to the same user (at a healthy margin).

There are other historical lessons in the many companies that were lauded for their meteoric rise in user counts (and [resulting](http://allthingsd.com/20080319/rockyou-the-400-million-widget/) [valuations](http://techcrunch.com/2012/04/26/viddy-is-raising-30m-at-a-370m-valuation/)), most of which came crashing back to Earth.

Most Internet companies would build better things and create more value if they paid more attention to depth than breadth.","If you look at the other best tech company there is — Apple — it’s also clear they are not optimizing for number of people using their products. While network effects (and revenue) mean that they clearly care about that, they’ve built the most valuable company on the planet by focusing on building the best product possible — in fact, one of their strategies is building an integrated set of products and selling as many of them as possible to the same user (at a healthy margin). There are other historical lessons in the many companies that were lauded for their meteoric rise in user counts (and resulting valuations), most of which came crashing back to Earth. Most Internet companies would build better things and create more value if they paid more attention to depth than breadth.",Apple has built the most valuable company on the planet by focusing on building the best product possible. Most Internet companies would build better things and create more value if they paid more attention to depth than breadth.,Apple has built the most valuable company on the planet by focusing on building the best product possible. Most Internet companies would build better things and create more value if they paid more attention to depth than breadth.
