source_with_markdown,source_without_markdown,target_without_markdown,target_with_markdown
Because I would dedicate myself to understanding both sides of the argument so thoroughly that I could argue your side for you and win; even after having just handed you a defeat in the same debate.,Because I would dedicate myself to understanding both sides of the argument so thoroughly that I could argue your side for you and win; even after having just handed you a defeat in the same debate.," I would dedicate myself to understanding both sides of the argument so thoroughly that I could argue your side for you and win, even after having just handed you a defeat in the same debate.","I would dedicate myself to understanding both sides of the argument so thoroughly that I could argue your side for you and win, even after having just handed you a defeat in the same debate."
"Because you do not question authority.

Because you don’t question yourself.

Because you don’t understand the power of properly placed questioning in life, respectful disagreements and standing up for what you know to be right in the face of someone telling you otherwise. Unable to question reality; stuck in a self imposed survival strategy within a matrix-style monotony.

Because I know that you will give me all the information I need to destroy you by letting you talk.

Because I study human behaviors and you ignore everyone but yourself.

Because I watch how you say the things you say just as closely as I listen to what you say; and you say way too much!

Because control comes, not from spewing your ignorance like some incurable case of logorrhea, but from properly structuring the context of your questions.

Because I study the premise of your argument and destroy it from the ground level before you even get a chance to establish your ideas.","Because you do not question authority. Because you don’t question yourself. Because you don’t understand the power of properly placed questioning in life, respectful disagreements and standing up for what you know to be right in the face of someone telling you otherwise. Unable to question reality; stuck in a self imposed survival strategy within a matrix-style monotony. Because I know that you will give me all the information I need to destroy you by letting you talk. Because I study human behaviors and you ignore everyone but yourself. Because I watch how you say the things you say just as closely as I listen to what you say; and you say way too much! Because control comes, not from spewing your ignorance like some incurable case of logorrhea, but from properly structuring the context of your questions. Because I study the premise of your argument and destroy it from the ground level before you even get a chance to establish your ideas.","Because you don’t question yourself. Because you don't understand the power of properly placed questioning in life, respectful disagreements and standing up for what you know to be right in the face of someone telling you otherwise.","Because you don’t question yourself. Because you don't understand the power of properly placed questioning in life, respectful disagreements and standing up for what you know to be right in the face of someone telling you otherwise."
"Because you refuse to admit that you don’t even know the things you don’t know.

Because there isn’t an article online that would make up for all the time you have wasted in life.

Because even if I told you everything could be different tomorrow you would wait until then to begin doing anything about it.

Because even when you think I’m not, I’m aware of my surroundings.

Because you think that since I have not acknowledged you, it means that I have not seen you.

Because, you walk around with your head up your ass, oblivious to the world around you. Blissfully ignorant of the reality that sits so close to your face that if you stuck your tongue out, just once, you would taste it and realize how delicious the truth actually is.

Because you would become an instant addict. Unable to pull yourself from the teat of truth. Finally able to understand your lack of understanding, and then you would see; then you would know that the only thing holding you back from doing something truly amazing, is you.","Because you refuse to admit that you don’t even know the things you don’t know. Because there isn’t an article online that would make up for all the time you have wasted in life. Because even if I told you everything could be different tomorrow you would wait until then to begin doing anything about it. Because even when you think I’m not, I’m aware of my surroundings. Because you think that since I have not acknowledged you, it means that I have not seen you. Because, you walk around with your head up your ass, oblivious to the world around you. Blissfully ignorant of the reality that sits so close to your face that if you stuck your tongue out, just once, you would taste it and realize how delicious the truth actually is. Because you would become an instant addict. Unable to pull yourself from the teat of truth. Finally able to understand your lack of understanding, and then you would see; then you would know that the only thing holding you back from doing something truly amazing, is you."," If I told you everything could be different tomorrow you would wait until then to begin doing anything about it. Because even when you think I'm not, I’m aware of my surroundings. Because you walk around with your head up your ass, oblivious to the world around you.","If I told you everything could be different tomorrow you would wait until then to begin doing anything about it. Because even when you think I'm not, I’m aware of my surroundings. Because you walk around with your head up your ass, oblivious to the world around you."
"**By Hossein Derakhshan  
**_Illustrations by Tim McDonagh_

![S](https://miro.medium.com/max/138/1*QbKYMRrm4LYiAeG71DUODA.png)S**even months ago**, I sat down at the small table in the kitchen of my 1960s apartment, nestled on the top floor of a building in a vibrant central neighbourhood of Tehran, and I did something I had done thousands of times previously. I opened my laptop and posted to my new blog. This, though, was the first time in six years. And it nearly broke my heart.

A few weeks earlier, I’d been abruptly pardoned and freed from Evin prison in northern Tehran. I had been expecting to spend most of my life in those cells: In November 2008, I’d been sentenced to nearly 20 years in jail, mostly for things I’d written on my blog.","By Hossein Derakhshan  Illustrations by Tim McDonagh Seven months ago, I sat down at the small table in the kitchen of my 1960s apartment, nestled on the top floor of a building in a vibrant central neighbourhood of Tehran, and I did something I had done thousands of times previously. I opened my laptop and posted to my new blog. This, though, was the first time in six years. And it nearly broke my heart. A few weeks earlier, I’d been abruptly pardoned and freed from Evin prison in northern Tehran. I had been expecting to spend most of my life in those cells: In November 2008, I’d been sentenced to nearly 20 years in jail, mostly for things I’d written on my blog.",Hossein Derakhshan was sentenced to nearly 20 years in jail in November 2008. He had been pardoned and freed from Evin prison in northern Tehran.,I was sentenced to nearly 20 years in jail in November 2008. I have now been pardoned and freed from Evin prison in northern Tehran.
"Around me, I noticed a very different Tehran from the one I’d been used to. An influx of new, shamelessly luxurious condos had replaced the charming little houses I was familiar with. New roads, new highways, hordes of invasive SUVs. Large billboards with advertisements for Swiss-made watches and Korean flat screen TVs. Women in colorful scarves and manteaus, men with dyed hair and beards, and hundreds of charming cafes with hip western music and female staff. They were the kinds of changes that creep up on people; the kind you only really notice once normal life gets taken away from you.

Two weeks later, I began writing again. Some friends agreed to let me start a blog as part of their arts magazine. I called it [_Ketabkhan_](http://blogs.tarjomaan.com/books/) — it means book-reader in Persian.","Around me, I noticed a very different Tehran from the one I’d been used to. An influx of new, shamelessly luxurious condos had replaced the charming little houses I was familiar with. New roads, new highways, hordes of invasive SUVs. Large billboards with advertisements for Swiss-made watches and Korean flat screen TVs. Women in colorful scarves and manteaus, men with dyed hair and beards, and hundreds of charming cafes with hip western music and female staff. They were the kinds of changes that creep up on people; the kind you only really notice once normal life gets taken away from you. Two weeks later, I began writing again. Some friends agreed to let me start a blog as part of their arts magazine. I called it Ketabkhan — it means book-reader in Persian."," Tehran has changed from the charming little houses I was familiar with to new, shamelessly luxurious condos."," Tehran has changed from the charming little houses I was familiar with to new, shamelessly luxurious condos."
"Six years was a long time to be in jail, but it’s an entire era online. Writing on the internet itself had not changed, but _reading_ — or, at least, getting things read — had altered dramatically. I’d been told how essential social networks had become while I’d been gone, and so I knew one thing: If I wanted to lure people to see my writing, I had to use social media now.

So I tried to post a link to one of my stories on Facebook. Turns out Facebook didn’t care much. It ended up looking like a boring classified ad. No description. No image. Nothing. It got three likes. Three! That was it.

It became clear to me, right there, that things had changed. I was not equipped to play on this new turf — all my investment and effort had burned up. I was devastated.","Six years was a long time to be in jail, but it’s an entire era online. Writing on the internet itself had not changed, but reading — or, at least, getting things read — had altered dramatically. I’d been told how essential social networks had become while I’d been gone, and so I knew one thing: If I wanted to lure people to see my writing, I had to use social media now. So I tried to post a link to one of my stories on Facebook. Turns out Facebook didn’t care much. It ended up looking like a boring classified ad. No description. No image. Nothing. It got three likes. Three! That was it. It became clear to me, right there, that things had changed. I was not equipped to play on this new turf — all my investment and effort had burned up. I was devastated.","Six years in jail was a long time to be in jail, but it's an entire era online.","Six years in jail was a long time to be in jail, but it's an entire era online."
"![B](https://miro.medium.com/max/150/1*W5V3Agjhs4GaZd-PuEZA_w.png)B**logs were gold** and bloggers were rock stars back in 2008 when I was arrested. At that point, and despite the fact the state was blocking access to [my blog](https://web.archive.org/web/20081030105806/http://i.hoder.com/) from inside Iran, I had an audience of around 20,000 people every day. Everybody I linked to would face a sudden and serious jump in traffic: I could empower or embarrass anyone I wanted.","Blogs were gold and bloggers were rock stars back in 2008 when I was arrested. At that point, and despite the fact the state was blocking access to my blog from inside Iran, I had an audience of around 20,000 people every day. Everybody I linked to would face a sudden and serious jump in traffic: I could empower or embarrass anyone I wanted.",Blogs were gold and bloggers were rock stars back in 2008 when I was arrested.,![B](https://miro.medium.com/max/150/1*W5V3Agjhs4GaZd-PuEZA_w.png)B**logs were gold** and bloggers were rock stars back in 2008 when I was arrested.
"People used to carefully read my posts and leave lots of relevant comments, and even many of those who strongly disagreed with me still came to read. Other blogs linked to mine to discuss what I was saying. I felt like a king.

The iPhone was a little over a year old by then, but smartphones were still mostly used to make phone calls and send short messages, handle emails, and surf the web. There were no real apps, certainly not how we think of them today. There was no Instagram, no SnapChat, no Viber, no WhatsApp.

Instead, there was the web, and on the web, there were blogs: the best place to find alternative thoughts, news and analysis. They were my life.","People used to carefully read my posts and leave lots of relevant comments, and even many of those who strongly disagreed with me still came to read. Other blogs linked to mine to discuss what I was saying. I felt like a king. The iPhone was a little over a year old by then, but smartphones were still mostly used to make phone calls and send short messages, handle emails, and surf the web. There were no real apps, certainly not how we think of them today. There was no Instagram, no SnapChat, no Viber, no WhatsApp. Instead, there was the web, and on the web, there were blogs: the best place to find alternative thoughts, news and analysis. They were my life."," The iPhone was a little over a year old by then, but smartphones were still mostly used to make phone calls and send short messages. There were no real apps, certainly not how we think of them today. Instead, there were blogs: the best place to find alternative thoughts, news and analysis.","The iPhone was a little over a year old by then, but smartphones were still mostly used to make phone calls and send short messages. There were no real apps, certainly not how we think of them today. Instead, there were blogs: the best place to find alternative thoughts, news and analysis."
"**It had all** started with 9/11. I was in Toronto, and my father had just arrived from Tehran for a visit. We were having breakfast when the second plane hit the World Trade Center. I was puzzled and confused and, looking for insights and explanations, I came across blogs. Once I read a few, I thought: This is it, I should start one, and encourage all Iranians to start blogging as well. So, using Notepad on Windows, I started experimenting. Soon I ended up writing on [hoder.com](https://web.archive.org/web/20020613100521/http://hoder.com/i/default.asp), using Blogger’s publishing platform before Google bought it.","It had all started with 9/11. I was in Toronto, and my father had just arrived from Tehran for a visit. We were having breakfast when the second plane hit the World Trade Center. I was puzzled and confused and, looking for insights and explanations, I came across blogs. Once I read a few, I thought: This is it, I should start one, and encourage all Iranians to start blogging as well. So, using Notepad on Windows, I started experimenting. Soon I ended up writing on hoder.com, using Blogger’s publishing platform before Google bought it.","It had all started with 9/11. I was puzzled and confused and, looking for insights and explanations, I came across blogs. Once I read a few, I thought: This is it, I should start one, and encourage all Iranians to start blogging as well","**It had all** started with 9/11. I was puzzled and confused and, looking for insights and explanations, I came across blogs. Once I read a few, I thought: This is it, I should start one, and encourage all Iranians to start blogging as well."
"Then, on November 5, 2001, I published [a step-to-step guide](https://web.archive.org/web/20030401200358/http://i.hoder.com/index.php?sec=guide) on how to start a blog. That sparked something that was later called a [blogging revolution](http://www.amazon.com/Blogistan-Internet-Politics-International-Library/dp/1845116070): Soon, hundreds and thousands of Iranians made it one of the top 5 nations by the number of blogs, and I was proud to have a role in this unprecedented democratization of writing.

Those days, I used to keep [a list of all blogs in Persian](https://web.archive.org/web/20020802005944/http://hoder.com/i/links.asp) and, for a while, I was the first person any new blogger in Iran would contact, so they could get on the list. That’s why they called me “[the blogfather](https://www.flickr.com/photos/hoder/1878402927/)” in my mid-twenties — it was a silly nickname, but at least it hinted at how much I cared.","Then, on November 5, 2001, I published a step-to-step guide on how to start a blog. That sparked something that was later called a blogging revolution: Soon, hundreds and thousands of Iranians made it one of the top 5 nations by the number of blogs, and I was proud to have a role in this unprecedented democratization of writing. Those days, I used to keep a list of all blogs in Persian and, for a while, I was the first person any new blogger in Iran would contact, so they could get on the list. That’s why they called me “the blogfather” in my mid-twenties — it was a silly nickname, but at least it hinted at how much I cared.","On November 5, 2001, Iran became one of the top 5 nations by the number of blogs.","On November 5, 2001, Iran became one of the top 5 nations by the number of blogs."
"Every morning, from my small apartment in downtown Toronto, I opened my computer and took care of the new blogs, helping them gain exposure and audience. It was a diverse crowd — from exiled authors and journalists, female diarists, and technology experts, to local journalists, politicians, clerics, and war veterans — and I always encouraged even more. I invited more religious, and pro-Islamic Republic men and women, people who lived inside Iran, to join and start writing.

The breadth of what was available those days amazed us all. It was partly why I promoted blogging so seriously. I’d left Iran in late 2000 to experience living in the West, and was scared that I was missing all the rapidly emerging trends at home. But reading [Iranian blogs](https://en.wikipedia.org/wiki/Blogging_in_Iran) in Toronto was the closest experience I could have to sitting in a shared taxi in Tehran and listening to collective conversations between the talkative driver and random passengers.","Every morning, from my small apartment in downtown Toronto, I opened my computer and took care of the new blogs, helping them gain exposure and audience. It was a diverse crowd — from exiled authors and journalists, female diarists, and technology experts, to local journalists, politicians, clerics, and war veterans — and I always encouraged even more. I invited more religious, and pro-Islamic Republic men and women, people who lived inside Iran, to join and start writing. The breadth of what was available those days amazed us all. It was partly why I promoted blogging so seriously. I’d left Iran in late 2000 to experience living in the West, and was scared that I was missing all the rapidly emerging trends at home. But reading Iranian blogs in Toronto was the closest experience I could have to sitting in a shared taxi in Tehran and listening to collective conversations between the talkative driver and random passengers.","Every morning, from my small apartment in downtown Toronto, I opened my computer and took care of the new blogs. The breadth of what was available those days amazed us all. It was partly why I promoted blogging so seriously.","Every morning, from my small apartment in downtown Toronto, I opened my computer and took care of the new blogs. The breadth of what was available those days amazed us all. It was partly why I promoted blogging so seriously."
"![T](https://miro.medium.com/max/152/1*ip87iQg84Rf_IIqtt35mLg.png)T**here’s a story** in the Quran that I thought about a lot during my first eight months in solitary confinement. In it, a group of persecuted Christians find refuge in a cave. They, and a dog they have with them, fall into a deep sleep. They wake up under the impression that they’ve taken a nap: In fact, it’s 300 years later. One version of the story tells of how one of them goes out to buy food — and I can only imagine how hungry they must’ve been after 300 years — and discovers that his money is obsolete now, a museum item. That’s when he realizes how long they have actually been absent.","There’s a story in the Quran that I thought about a lot during my first eight months in solitary confinement. In it, a group of persecuted Christians find refuge in a cave. They, and a dog they have with them, fall into a deep sleep. They wake up under the impression that they’ve taken a nap: In fact, it’s 300 years later. One version of the story tells of how one of them goes out to buy food — and I can only imagine how hungry they must’ve been after 300 years — and discovers that his money is obsolete now, a museum item. That’s when he realizes how long they have actually been absent.",There's a story in the Quran that I thought about a lot during my first eight months in solitary confinement.,![T](https://miro.medium.com/max/152/1*ip87iQg84Rf_IIqtt35mLg.png)T**here’s a story** in the Quran that I thought about a lot during my first eight months in solitary confinement.
"The hyperlink was my currency six years ago. Stemming from the idea of the [hypertext](http://www.cyberartsweb.org/cpace/ht/htov.html), the hyperlink provided a diversity and decentralisation that the real world lacked. The hyperlink represented the open, interconnected spirit of the world wide web — a vision that started with its inventor, Tim Berners-Lee. The hyperlink was a way to abandon centralization — all the links, lines and hierarchies — and replace them with something more distributed, a system of nodes and networks.

Blogs gave form to that spirit of decentralization: They were _windows_ into lives you’d rarely know much about; _bridges_ that connected different lives to each other and thereby changed them. Blogs were _cafes_ where people exchanged diverse ideas on any and every topic you could possibly be interested in. They were Tehran’s taxicabs writ large.

Since I got out of jail, though, I’ve realized how much the hyperlink has been devalued, almost made obsolete.","The hyperlink was my currency six years ago. Stemming from the idea of the hypertext, the hyperlink provided a diversity and decentralisation that the real world lacked. The hyperlink represented the open, interconnected spirit of the world wide web — a vision that started with its inventor, Tim Berners-Lee. The hyperlink was a way to abandon centralization — all the links, lines and hierarchies — and replace them with something more distributed, a system of nodes and networks. Blogs gave form to that spirit of decentralization: They were windows into lives you’d rarely know much about; bridges that connected different lives to each other and thereby changed them. Blogs were cafes where people exchanged diverse ideas on any and every topic you could possibly be interested in. They were Tehran’s taxicabs writ large. Since I got out of jail, though, I’ve realized how much the hyperlink has been devalued, almost made obsolete."," The hyperlink represented the open, interconnected spirit of the world wide web. It was a vision that started with its inventor, Tim Berners-Lee.","The hyperlink represented the open, interconnected spirit of the world wide web. It was a vision that started with its inventor, Tim Berners-Lee."
"Nearly every social network now treats a link as just the same as it treats any other object — the same as a photo, or a piece of text — instead of seeing it as a way to make that text richer. You’re encouraged to post one single hyperlink and expose it to a quasi-democratic process of liking and plussing and hearting: Adding several links to a piece of text is usually not allowed. Hyperlinks are objectivized, isolated, stripped of their powers.","Nearly every social network now treats a link as just the same as it treats any other object — the same as a photo, or a piece of text — instead of seeing it as a way to make that text richer. You’re encouraged to post one single hyperlink and expose it to a quasi-democratic process of liking and plussing and hearting: Adding several links to a piece of text is usually not allowed. Hyperlinks are objectivized, isolated, stripped of their powers.",Nearly every social network now treats a link as just the same as it treats any other object. Adding several links to a piece of text is usually not allowed.,Nearly every social network now treats a link as just the same as it treats any other object. Adding several links to a piece of text is usually not allowed.
