source_with_markdown,source_without_markdown,target_without_markdown
"* Though he was criticized for it, President Ronald Reagan famously took naps as well.","Though he was criticized for it, President Ronald Reagan famously took naps as well.","Despite being chastised for it, President Ronald Reagan took naps as well."
Source: [_5 Reasons Why You Should Take a Nap Every Day — Michael Hyatt_](http://michaelhyatt.com/why-you-should-take-a-nap-every-day.html),Source: 5 Reasons Why You Should Take a Nap Every Day — Michael Hyatt,5 Reasons Why You Should Take a Nap Every Day — Michael Hyatt —
"In a [2012 study](http://www.jstor.org/discover/10.1086/663212?uid=3739448&uid=2&uid=3737720&uid=4&sid=21103023192873) published in the _Journal of Consumer Research_, researchers split 120 students in two groups.","In a 2012 study published in the Journal of Consumer Research, researchers split 120 students in two groups.",Researchers divided 120 students into two groups in a 2012 study that was published in the Journal of Consumer Research.
I learned the power of community and [why brands need user-generated content](http://blog.filemobile.com/benefits-user-generated-content/).,I learned the power of community and why brands need user-generated content.,I discovered the power of community and that brands need user-generated content.
"Did you know that, according to [Octoly](http://www.reelseo.com/earned-media-rankings-youtube-octoly/), user-generated videos are viewed 10 times more than brand-generated videos on YouTube?","Did you know that, according to Octoly, user-generated videos are viewed 10 times more than brand-generated videos on YouTube?",Did you know that user-generated videos on YouTube are viewed ten times more than brand-generated videos?
"When seeking information about a particular brand, [over half](http://resources.bazaarvoice.com/rs/bazaarvoice/images/201202_Millennials_whitepaper.pdf) (51 percent) of Americans trust user-generated content more than what’s on the brand’s official website (16 percent) or media coverage on the brand (14 percent).","When seeking information about a particular brand, over half (51 percent) of Americans trust user-generated content more than what’s on the brand’s official website (16 percent) or media coverage on the brand (14 percent).",Over half (51 percent) of Americans trust user-generated content more than what's on the brand's official website (16 percent) or media coverage (14 percent).
"Simon Sherry, a psychology professor at Dalhousie University who conducted a [study on perfectionism and productivity](http://www.universityaffairs.ca/perfectionist-professors-have-lower-research-productivity.aspx), told _University Affairs_.","Simon Sherry, a psychology professor at Dalhousie University who conducted a study on perfectionism and productivity, told University Affairs.","University Affairs spoke to Simon Sherry, a psychology professor at Dalhousie University who conducted a research on perfectionism and productivity."
"* They spend more time than required on a task.
* They procrastinate and wait for the perfect moment.","They spend more time than required on a task.
They procrastinate and wait for the perfect moment.",They procrastinate and wait for the right time to do a task.
"In business, if it is the perfect moment, you are too late.
* They miss the big picture while focusing too much on the small things.","In business, if it is the perfect moment, you are too late.
* They miss the big picture while focusing too much on the small things.","If it is the right time for business, you are too late."
**The perfect moment is NOW.**,The perfect moment is NOW.,Now is the time to act.
**Tips for marketers:** check out [GitHub](https://github.com/) or [Google Apps Script library](https://developers.google.com/apps-script/guide_libraries).,Tips for marketers: check out GitHub or Google Apps Script library.,Marketers: Check out the GitHub or Google Apps Script library for developers.
"It’s important to walk away from work once in a while and have some alone time, which is good for the brain and spirit, according to “[The Power of Lonely](http://www.boston.com/bostonglobe/ideas/articles/2011/03/06/the_power_of_lonely/),” from _The Boston Globe_.","It’s important to walk away from work once in a while and have some alone time, which is good for the brain and spirit, according to “The Power of Lonely,” from The Boston Globe.","According to ""The Power of Lonely,"" from The Boston Globe, it's important to step away from work for a while and have some alone time."
"_Disclosure: Filemobile (acquired by NewZulu) is a former client of my agency,_ [_ThinkRenegade_](http://www.thinkrenegade.com/)_._","Disclosure: Filemobile (acquired by NewZulu) is a former client of my agency, ThinkRenegade.","Filemobile (acquired by NewZulu) is a former client of my company, ThinkRenegade."
_Travel to the places that will challenge who you think you want to be._,Travel to the places that will challenge who you think you want to be.,Travel to the places that will make you question who you want to be.
Spend time figuring out what your own world view is (**see point 1**) and where you want to take your own life.,Spend time figuring out what your own world view is (see point 1) and where you want to take your own life.,Spend time discovering what your personal world view is (see point 1) and where you want to go for your own life.
If you don’t have a corporate job yet **see point 5**.,If you don’t have a corporate job yet see point 5.,See point 5 if you don't have a corporate career yet.
Just don’t do it (**see point 2**).,Just don’t do it (see point 2).,Just don't do it (see point 2)).
Don’t waste time with friends who don’t treat you the way you treat them (**see point 7**).,Don’t waste time with friends who don’t treat you the way you treat them (see point 7).,Don't waste time with friends who don't treat you the way they do (see point 7).
Get over that fact and start building things (**see point 2 and combine with point 9**).,Get over that fact and start building things (see point 2 and combine with point 9).,Get over the facts and start building (see point 2 and combine with point 9).
"Still, every year or so someone takes me aside and says, _you actually are weirdly polite, aren’t you?_ And I always thrill.","Still, every year or so someone takes me aside and says, you actually are weirdly polite, aren’t you? And I always thrill.","And yet, every year or so, someone takes me aside and says, You are actually polite, aren't you?"
"I was peripheral in high school — uncool but also untortured, voted “most scholarly” of my class, roughly equivalent to “least likely to have sex.” In high school _no one_ noticed my politeness except for one kid.","I was peripheral in high school — uncool but also untortured, voted “most scholarly” of my class, roughly equivalent to “least likely to have sex.” In high school no one noticed my politeness except for one kid.","I was peripheral in high school, uncool but also untortured, voted the most scholarly"" of my class, roughly equivalent to ""least likely to have sex"" in high school."
"“Why you always so _polite_, man?” he asked.","“Why you always so polite, man?” he asked.","""Why are you always so polite, man?"" he asked."
"Later, that same kid stole my cassette copy of _Aqualung._","Later, that same kid stole my cassette copy of Aqualung.","Later, the same child took my Aqualung cassette."
No one needs [visiting cards](http://en.wikipedia.org/wiki/Visiting_card) in college (although I’m surprised that they haven’t made a comeback among drama students).,No one needs visiting cards in college (although I’m surprised that they haven’t made a comeback among drama students).,No one needs visiting cards in college (although I'm surprised that they haven't made a comeback among drama students).
"Here’s the _New York Times_ journalist Jenna Wortham, in [an interview at _The Awl_](http://www.theawl.com/2014/04/my-hair-is-not-your-safari), on hair-touching:","Here’s the New York Times journalist Jenna Wortham, in an interview at The Awl, on hair-touching:","Jenna Wortham, a New York Times reporter, in an interview with The Awl on hair-touching: here's a look at it."
When _would_ it be appropriate?,When would it be appropriate?,When is it appropriate?
"If their name is now Susan, [it’s Susan](http://eatmorebikes.blogspot.com/2012/08/we-meet-again.html).","If their name is now Susan, it’s Susan.","Susan is Susan, if not Susan."
"Now, even though I prepped and studied etiquette books, I _learned_ all this the regular way, by screwing it up terribly and having to send emails of apology the next day.","Now, even though I prepped and studied etiquette books, I learned all this the regular way, by screwing it up terribly and having to send emails of apology the next day.","Now, even though I prepared and read etiquette books, I learned all this the hard way, by screwing it up and having to send emails of apology the next day."
"Sometimes I’ll get a call or email from someone five years after the last contact and I’ll think, _oh right, I hated that person._ But they would never have known, of course.","Sometimes I’ll get a call or email from someone five years after the last contact and I’ll think, oh right, I hated that person. But they would never have known, of course.","I'll get a call or email from someone five years old, and I'll think, oh, I hated the person, but they may not have known, of course."
_Let’s see if I still hate them._ Very often I find that I don’t.,Let’s see if I still hate them. Very often I find that I don’t.,Let's see if I still hate them. I don't usually do.
Not in airplane mode but _ON |_ **_OFF_**.,Not in airplane mode but ON | OFF.,"Not in airplane mode, but ON | OFF."
I had just returned from a camping trip where I ‘_witnessed’_ a beautiful sunset.,I had just returned from a camping trip where I ‘witnessed’ a beautiful sunset.,I had just returned from a camping trip where I had a stunning sunset.
"As I was reminiscing over the dozens of photos I took, I barely had any recollection of **_ACTUALLY_** being there.","As I was reminiscing over the dozens of photos I took, I barely had any recollection of ACTUALLY being there.",I had no recall of being there when I was reminiscing over the hundreds of photographs I took.
I’ve had the opportunity to build some really neat things ([thing 1](https://itunes.apple.com/us/app/weave/id444522442?mt=8) and [thing 2](https://itunes.apple.com/us/app/redbox-instant-by-verizon/id561226994?mt=8)) alongside very talented people.,I’ve had the opportunity to build some really neat things (thing 1 and thing 2) alongside very talented people.,I've had the opportunity to create some really cool stuff (thing 1 and thing 2) with some really talented people.
"Like a potato chip manufacturer, we try to put just the right crunch and the perfect amount of salt so you can’t help but have **_just one more_**.","Like a potato chip manufacturer, we try to put just the right crunch and the perfect amount of salt so you can’t help but have just one more.","We're trying to get just the right crunch and the right amount of salt, so you can't help but have just one more."
There have been several great posts and [humbling videos](https://www.youtube.com/watch?v=OINa46HeWg8) about mobile abuse so I hope I’m not beating a dead horse.,There have been several great posts and humbling videos about mobile abuse so I hope I’m not beating a dead horse.,"Several great blogs and humbling videos about cell abuse have appeared, so I hope I am not beating a dead horse."
**How I interacted with people in real life had fundamentally changed.** I couldn’t have one conversation without checking my phone.,How I interacted with people in real life had fundamentally changed. I couldn’t have one conversation without checking my phone.,How I interacted with people in real life had fundamentally changed. I couldn't have one conversation without checking my phone.
"I want it now.** We live in an _uber-_convenient (hue hue hue) time where ride-sharing, same-day delivery, and instant gratification are the norm.","I want it now.** We live in an _uber-_convenient (hue hue hue) time where ride-sharing, same-day delivery, and instant gratification are the norm.","I want it now. We live in a world where ride-sharing, same-day delivery, and instant gratification are the norm."
"I live in one of the most walkable cities on the planet, [San Francisco](http://www.walkscore.com/CA/San_Francisco).","I live in one of the most walkable cities on the planet, San Francisco.","I live in San Francisco, one of the world's most walkable cities."
"**Decreased recall & critical thinking.** Remember the glory days when you would spend an entire afternoon playfully arguing with a spouse, sibling, or friend about some trivial factual disagreement like which NFL team had the most Super Bowl wins?","Decreased recall & critical thinking. Remember the glory days when you would spend an entire afternoon playfully arguing with a spouse, sibling, or friend about some trivial factual disagreement like which NFL team had the most Super Bowl wins?","Remember the days when you'd spend an entire afternoon arguing with a spouse, sibling, or friend over a trivial factual disagreement, such as which NFL team had the most Super Bowl victories?"
"Constant push notifications, emails, and messages meant I could never _shut down_ and _turn off_.","Constant push notifications, emails, and messages meant I could never shut down and turn off.","Constant push notifications, emails, and emails meant I could never shut down and turn off."
"**Appointments are moving targets.** Let’s take another trip down memory lane, the year: 1992.","Appointments are moving targets. Let’s take another trip down memory lane, the year: 1992.",Appointments are on target to be recalled. The year 1992.
Why not pass the time with a quick game of [Three’s](https://itunes.apple.com/us/app/threes!/id779157948?mt=8)?,Why not pass the time with a quick game of Three’s?,Why not skip the time with a quick game of Three's?
I’ve summarized these tricks into a program I’m calling **_the mobile cleanse_**.,I’ve summarized these tricks into a program I’m calling the mobile cleanse.,I've distilled these tips into a service that I'm calling the phone cleanse.
**Keep _it_ in your pants.** This is an obvious one.,Keep it in your pants. This is an obvious one.,This is a simple one.
The _itch_ soon decreased.,The itch soon decreased.,The itching was gone quickly.
"**Brain first, phone second.** Can’t think of the artist for a song you just heard?","Brain first, phone second. Can’t think of the artist for a song you just heard?",Can't remember the artist's name for a song you just heard?
**Hide and delete.** This is the mobile cleanse mantra.,Hide and delete. This is the mobile cleanse mantra.,This is the mobile purge mantra.
Turn **_ALL_** notifications & badges off.,Turn ALL notifications & badges off.,Turn off ALL notifications and badges.
Set your phone to silent (not _VIBRATE_).,Set your phone to silent (not VIBRATE).,Set your phone to silent (not VIBRATE).
"When mobile browsing is acceptable, **_PULL_** the information you seek (manual refresh, etc).","When mobile browsing is acceptable, PULL the information you seek (manual refresh, etc).","If mobile browsing is allowed, PULL the details you need (manual refresh, etc.)."
**Your delivery is free if it’s a mile or less.** Never Uber / Lyft / Sidecar if your destination is < 1mile.,Your delivery is free if it’s a mile or less. Never Uber / Lyft / Sidecar if your destination is < 1mile.,"If your destination is within a mile or less, your delivery is free."
**Buy a watch.** I would often catch myself pulling out my phone to merely check the time (and then check the time again since I never actually remembered it the first time).,Buy a watch. I would often catch myself pulling out my phone to merely check the time (and then check the time again since I never actually remembered it the first time).,Buy a watch. I would often find myself pulling out my phone to simply check the time (and then check the time again since I never really remembered it the first time).
**No phones in the bedroom or bathroom.** Let’s focus on the bathroom first and [how much time you save](https://medium.com/) without your phone (see below for a non-scientific study of time spent on the toilet with and without a phone each day).,No phones in the bedroom or bathroom. Let’s focus on the bathroom first and how much time you save without your phone (see below for a non-scientific study of time spent on the toilet with and without a phone each day).,"No phones in the bedroom or bathroom, let's first concentrate on the bathroom and how much money you save without your phone (see below for a non-scientific analysis of time spent in the toilet with and without a phone each day)."
It’s proven that [looking at bright screens](http://i2.kym-cdn.com/photos/images/original/000/133/088/2320c993_92f3_b20b.jpg) just before bed increases the time it takes to fall asleep.,It’s proven that looking at bright screens just before bed increases the time it takes to fall asleep.,It's been shown that viewing bright screens right before bed increases the time it takes to fall asleep.
"**_Please share / recommend_** this article to help friends become human again and tweet me directly (@jgvandehey) to let me know how it goes or if you need a sponsor, support, or tips.","Please share / recommend this article to help friends become human again and tweet me directly (@jgvandehey) to let me know how it goes or if you need a sponsor, support, or tips.","Please share/recommend this article to help friends become human again, and then tweet me directly (@jgvandehey) to let me know how it goes or if you need a sponsor, help, or tips."
A quick google search for “[should designers learn to code](https://www.google.com/webhp?sourceid=chrome-instant&ion=1&espv=2&ie=UTF-8#q=should%20designers%20learn%20to%20code)” yields 25 million results.,A quick google search for “should designers learn to code” yields 25 million results.,"A quick google search for ""should designers learn to code"" returns 25 million hits."
What we should be saying is that we need more designers who know **_about_** code**_._**,What we should be saying is that we need more designers who know about code.,"We need more designers who are aware of code, which is what we should be saying."
"The reason designers should know _about_ code, is the same reason developers should know _about_ design.","The reason designers should know about code, is the same reason developers should know about design.",The reason why designers should care about code is the same reason that developers should be aware of design.
The problem is that a Swiss Army knife doesn’t do _anything_ particularly well.,The problem is that a Swiss Army knife doesn’t do anything particularly well.,"A Swiss Army knife doesn't do well, which is the issue."
"And yes, part of that work means learning **_about_** code, so they can be effective, empathetic members of the larger product team.","And yes, part of that work means learning about code, so they can be effective, empathetic members of the larger product team.","Yes, code learning is involved in this process, so they can be efficient, empathetic members of the larger product team."
"Now, implicit in learning _about_ code or _about_ design is getting your hands dirty.","Now, implicit in learning about code or about design is getting your hands dirty.","Now, you're getting your hands dirty while learning about code or design."
"But we need to rid ourselves of the idea (and pressure) that designers should _be_ coders, or that developers should _be_ designers.","But we need to rid ourselves of the idea (and pressure) that designers should be coders, or that developers should be designers.","However, we need to get rid of the belief (and pressure) that designers should be coders or that developers should be designers."
"Join my free newsletter for more thoughts on design, technology, and society delivered straight to your inbox: [https://designlikeyoumeanit.substack.com/](https://designlikeyoumeanit.substack.com/)","Join my free newsletter for more thoughts on design, technology, and society delivered straight to your inbox: https://designlikeyoumeanit.substack.com/","Subscribe to my free newsletter for more information on design, electronics, and society, delivered right to your inbox: https://www.designlikeyoumeanit.com/"
It’s called **the professional yell**.,It’s called the professional yell.,It's called the yell of a pro.
US Money says it is the [#1 sign you have a bad boss](http://money.usnews.com/money/blogs/outside-voices-careers/2011/09/05/10-signs-you-have-a-bad-boss).,US Money says it is the #1 sign you have a bad boss.,"According to US Money, it is the first sign you have a bad boss."
"In his forthright biography, _Steve Jobs_, Isaac Walterson said Jobs’ “nasty edge was not necessary”:","In his forthright biography, Steve Jobs, Isaac Walterson said Jobs’ “nasty edge was not necessary”:","Jobs' ""nasty edge was not necessary,"" Steve Jobs said in his forthright biography:"
"At the time of writing this, my social media networks are fraught with clips and stories of [violent riots](http://www.cnn.com/2015/04/27/us/baltimore-unrest/index.html) in Baltimore.","At the time of writing this, my social media networks are fraught with clips and stories of violent riots in Baltimore.",My social media pages are brimming with clips and accounts of violent riots in Baltimore at the time of writing this article.
"Ray Lewis, Baltimore Ravens’ gargantuan linebacker, posted a video on his [Facebook page](https://www.facebook.com/officialraylewis) and within 8 hours reached well-over 15.5 million views.","Ray Lewis, Baltimore Ravens’ gargantuan linebacker, posted a video on his Facebook page and within 8 hours reached well-over 15.5 million views.","Ray Lewis, the Baltimore Ravens' gargantuan linebacker, posted a video on Facebook and gained over 15.5 million views within 8 hours."
"It was a [video](https://www.facebook.com/officialraylewis/videos/10153320592515701) of him yelling at the rioters to get off the streets of Baltimore, the city he loves so passionately.","It was a video of him yelling at the rioters to get off the streets of Baltimore, the city he loves so passionately.","It was a video of him screaming at the rioters to get off the streets of Baltimore, the city he adores so passionately."
"Morag Barrett, the CEO of [SkyeTeam](http://skyeteam.com/team/morag-barrett/), a leadership development company, [said](http://www.huffingtonpost.com/2015/03/13/steve-jobs-yelled-at-tim-cook-a-few-times_n_6864734.html), “Raising your voice at the right level and the right time is the skill of a great leader.”","Morag Barrett, the CEO of SkyeTeam, a leadership development company, said, “Raising your voice at the right level and the right time is the skill of a great leader.”","""Raising your voice at the right level and at the right time is the ability of a great leader,"" Morag Barrett, a leadership development firm, said."
"At its core, it takes a good amount of **self-awareness.** Do not begin professionally yelling until you _first_ have the ability to take a third-person view of yourself, assessing your own temperament, as well your impact on others around you.","At its core, it takes a good amount of self-awareness. Do not begin professionally yelling until you first have the ability to take a third-person view of yourself, assessing your own temperament, as well your impact on others around you.","It takes a great deal of self-awareness at the start of your career, as well as your effect on others around you."
**The professional yell is vision-based**.,The professional yell is vision-based.,The career yell is vision-based.
"**The professional yell is emotional, but not out of control**.","The professional yell is emotional, but not out of control.","The professional yell is emotional, but not out of place."
**The professional yell is not personal**.,The professional yell is not personal.,The professional yell is not personal.
"_Ad hominem_ is latin for “to the man” or “to the person.” Meaning, you are more focused on insulting the character of the other person than on solving the problem.","Ad hominem is latin for “to the man” or “to the person.” Meaning, you are more focused on insulting the character of the other person than on solving the problem.","Ad hominem is latin for ""to the man"" or ""to the individual."" In other words, you're more concerned about insulting the person's character than solving the problem."
"The [One Minute Manager](http://www.amazon.com/dp/0688014291/?), a quick read used by millions of managers in Fortune 500 companies and small businesses nationwide, talked about the three most critical conversations a manager can have with an employee:","The One Minute Manager, a quick read used by millions of managers in Fortune 500 companies and small businesses nationwide, talked about the three most critical conversations a manager can have with an employee:","The One Minute Manager, a quick read that has been used by millions of executives in Fortune 500 companies and small businesses around the country, discussed the three most important conversations a manager can have with an employee:"
