source_with_markdown,source_without_markdown,target_without_markdown
"For more information on proof of history, I recommend you to go through [whitepaper](https://solana.com/solana-whitepaper.pdf) of Solana.","For more information on proof of history, I recommend you to go through whitepaper of Solana.","For more details on proof of history, I recommend you to read Solana's whitepaper."
There is a very good [book](https://doc.rust-lang.org/book/) available to learn Rust.,There is a very good book available to learn Rust.,Rust is a very good book to learn about.
[Solana Tool Suit](https://docs.solana.com/cli/install-solana-cli-tools) — This includes the Solana CLI.,Solana Tool Suit — This includes the Solana CLI.,Solana Tool Suit — This includes the Solana CLI.
The code for this project can be found [here](https://github.com/anmoldh121/solana-counter).,The code for this project can be found here.,The source code for this project can be found here.
`program` — This is the directory of Solana programs (Smart contracts),program — This is the directory of Solana programs (Smart contracts),This is the Solana program's directory (Smart contracts) — here is the link to the Solana website.
`test` — This is where javascript test code lives,test — This is where javascript test code lives,This is where the javascript test code lives.
`migrations` — This is the deploy script,migrations — This is the deploy script,Migrations — This is the deploy script.
`app` — This is where frontend is going to be built,app — This is where frontend is going to be built,App — This is where the frontend is going to be built.
Let’s look at our `lib.rs` file in the program directory.,Let’s look at our lib.rs file in the program directory.,Let's take a look at our lib.rs file in the program directory.
"For more information, I recommend reading [this](https://solana.wiki/zh-cn/docs/account-model/#:~:text=On%20Solana%2C%20any%20account%20can,completely%20stored%20in%20other%20accounts.).","For more information, I recommend reading this.","For more details, I recommend reading this."
"In the above code we have defined two structs, the `CounterAccount` struct is our `Account` contains a count variable that is going to store our count.","In the above code we have defined two structs, the CounterAccount struct is our Account contains a count variable that is going to store our count.",Two structs have been defined in the above code: Our Account has a count variable that will be used to store our number.
"The `Create` struct is our instruction struct that defines our context for creating an account, that is saying, “Hey I want to create an account counter\_account with the space 32 byte”.","The Create struct is our instruction struct that defines our context for creating an account, that is saying, “Hey I want to create an account counter_account with the space 32 byte”.","""I want to create an account counter_account with the space 32 byte,"" the Create struct specifies our account context for creating an account."
The `#[account(…)]` attributes define constraints and instructions in preprocessing done by Anchor to create context.,The #[account(…)] attributes define constraints and instructions in preprocessing done by Anchor to create context.,The #[account(...)] attributes help anchors establish limits and instructions in preprocessing to provide context.
`create` function is our handler for rpc request which takes the context created with `Create` struct.,create function is our handler for rpc request which takes the context created with Create struct.,The create function is our handler for a rpc request that uses the context created with Create struct.
Be sure that `solana-test-validator` is running.,Be sure that solana-test-validator is running.,Be sure that the solana-test-validator is working.
"As this is a common issue, some companies like [p](https://prerender.io/)[rerender.io](http://rerender.io) sells it as a service.","As this is a common issue, some companies like prerender.io sells it as a service.","Because this is a common problem, some businesses, such as prerender.io, sell it as a service."
This is when [Victor Monginet](https://www.linkedin.com/in/victor-monginet) entered the game joining Doctrine a year ago.,This is when Victor Monginet entered the game joining Doctrine a year ago.,Victor Monginet first joined Doctrine a year ago.
He drafted an [RFC](https://medium.com/doctrine/doctrine-engineering-principles-and-practices-7faab666fac9) around how Server-Side Rendering (SSR) could solve this pain.,He drafted an RFC around how Server-Side Rendering (SSR) could solve this pain.,He wrote an RFC about how Server-Side Rendering (SSR) could be able to resolve this pain.
For API REST end-points we decided to keep the architecture simple so we proxied all the requests to the old server through the new one with the [Next.js’ rewrite feature](https://nextjs.org/docs/api-reference/next.config.js/rewrites).,For API REST end-points we decided to keep the architecture simple so we proxied all the requests to the old server through the new one with the Next.js’ rewrite feature.,"We decided to keep the API REST end-points simple, so we proxied all the requests to the old server using the Next.js' rewrite function."
To double down this point we created a benchmark of **357** decisions URLs that we considered important to us and we computed an average response time.,To double down this point we created a benchmark of 357 decisions URLs that we considered important to us and we computed an average response time.,"To get to the point, we created a benchmark of 357 decision URLs that we considered important to us and estimated an average response time."
**_SSR_** _→ Pure Server-side rendering part_,SSR → Pure Server-side rendering part,SSR  Pure Server-side rendering part.
**_SANITIZE_** _→ SEO Optimization of the HTML generated by SSR_,SANITIZE → SEO Optimization of the HTML generated by SSR,SANITIZE  SEO of the HTML created by SSR  SANITIZE  SEO Optimization of the HTML created by SSR.
**_REF_** **_DECISIONS_** _→ Loading of recommendations on the right side of the page which are normally rendered asynchronously_,REF DECISIONS → Loading of recommendations on the right side of the page which are normally rendered asynchronously,"REF DECISIONS  Loading of recommendations on the right side of the page, which are usually asynchronous process."
We are even prouder of our value about challenging the status quo that fosters an ambitious initiative [backed by RFC](https://medium.com/doctrine/doctrine-engineering-principles-and-practices-7faab666fac9).,We are even prouder of our value about challenging the status quo that fosters an ambitious initiative backed by RFC.,We're even prouder of our contribution to a new initiative that has been backed by RFC.
A key bonus is the pleasure of using cutting-edge technologies for current or [future talents that will join us](https://jobs.lever.co/doctrine/?team=Engineering).,A key bonus is the pleasure of using cutting-edge technologies for current or future talents that will join us.,A major benefit is the opportunity to use cutting-edge technologies for current or future employees that will join us.
I know many Alpha-Male (or Alpha-Female) entrepreneurs embrace the mentality of going **_All-In_**.,I know many Alpha-Male (or Alpha-Female) entrepreneurs embrace the mentality of going All-In.,Many Alpha-Male (or Alpha-Female) entrepreneurs embrace the mentality of going All-In.
"For more details, refer to [this article](https://medium.com/swlh/how-i-collect-timely-payments-for-my-copywriting-services-without-objections-and-headaches-21d5589be309?source=your_stories_page----------------------------------------).","For more details, refer to this article.",Refer to this article for more information.
"Sure, go **_All-In_** with your startup bets.","Sure, go All-In with your startup bets.","Yes, go all-in with your startup bets."
_“How can my startup(s) continue without me?”_,“How can my startup(s) continue without me?”,"""How can my startup(s) survive without me?"""
[**About the Author**](https://medium.com/about-me-stories/about-me-aldric-chen-55d52739259a?source=your_stories_page-------------------------------------)**:**,About the Author:,About the Author: About the Author:
Do reach out and say hi on [Linkedin](https://www.linkedin.com/in/connect-with-aldric/) and [Twitter](https://twitter.com/aldric_chen)!,Do reach out and say hi on Linkedin and Twitter!,"On Linkedin and Twitter, please reach out and say hello!"
"In December 2021, Sean shared some of the lessons learned in an extended fireside side and Q&A session in Paris during the_ [_Hello Tomorrow_](https://hello-tomorrow.org/summit/) _deep tech conference in Paris.","In December 2021, Sean shared some of the lessons learned in an extended fireside side and Q&A session in Paris during the_ Hello Tomorrow _deep tech conference in Paris.","During the _ Hello Tomorrow _deep tech conference in Paris in December 2021, Sean shared some of the lessons learned in an extended fireside session and Q&A session."
SOSV launched [HAX](https://hax.co/) in 2012 to focus on hardware oriented startups and [IndieBio](https://indiebio.co/) in 2014 to address biotech-based startups.,SOSV launched HAX in 2012 to focus on hardware oriented startups and IndieBio in 2014 to address biotech-based startups.,SOSV launched HAX in 2012 to focus on hardware-oriented startups and IndieBio in 2014 to support biotech-based startups.
"SOSV continues to invest in those companies through series seed, A and beyond through its core fund and a new [Select Fund](https://medium.com/sosv/sosv-announces-the-close-of-its-100m-select-fund-the-venture-investors-first-growth-stage-fund-acf3cc9d992e), which SOSV announced this year.","SOSV continues to invest in those companies through series seed, A and beyond through its core fund and a new Select Fund, which SOSV announced this year.","SOSV continues to invest in those companies through series seed, A and beyond, through its main fund and a new Select Fund, which SOSV announced this year."
"HAX has offices in Shenzhen, Tokyo, and San Francisco, and is opening a major new program in [Newark, NJ in 2022](https://hax.co/blog/hax-announces-us-hq-newark-new-jersey).","HAX has offices in Shenzhen, Tokyo, and San Francisco, and is opening a major new program in Newark, NJ in 2022.","HAX has offices in Shenzhen, Tokyo, and San Francisco, and is launching a major new initiative in Newark, NJ, 2022."
"We have made over [140 investments](https://medium.com/sosv/sosv-climate-tech-100-startups-value-grows-by-44-in-5-months-45d50662efd7), especially in alternative proteins, new materials and manufacturing/industrial solutions.","We have made over 140 investments, especially in alternative proteins, new materials and manufacturing/industrial solutions.","We have made over 140 investments, mainly in alternative proteins, new materials, and manufacturing/industrial solutions."
"**A: We are very interested in it and have made several deals in this space, like [unSpun](http://unspun.io) (on-demand custom jeans).","**A: We are very interested in it and have made several deals in this space, like unSpun (on-demand custom jeans).","A: We are very interested in it, and we have made several deals in this market, including unSpun (on-demand custom jeans)."
This is one of the key themes for our new [HAX center in New Jersey](https://techcrunch.com/2021/09/16/sosv-is-building-a-new-jersey-hax-facility-for-industrial-healthcare-and-climate-startups/).,This is one of the key themes for our new HAX center in New Jersey.,This is one of the main focus for our new HAX center in New Jersey.
"**A: We have made dozens of investments in various applications, from industrial robots to service robots like [Simbe](https://www.simberobotics.com/), which does autonomous inventory for retail.","**A: We have made dozens of investments in various applications, from industrial robots to service robots like Simbe, which does autonomous inventory for retail.","A: We've invested in hundreds of industries, from industrial robots to service robots like Simbe, which does autonomous inventory for retail."
"We made multiple deals in cleaning robots such as [Avidbots](https://www.avidbots.com/) (indoor commercial cleaning), [Viabot](https://www.viabot.com/) (outdoor cleaning) and [Somatic](http://getsomatic.com/) (bathroom cleaning.)","We made multiple deals in cleaning robots such as Avidbots (indoor commercial cleaning), Viabot (outdoor cleaning) and Somatic (bathroom cleaning.)","Multiple contracts were done in cleaning robots, including Avidbots (indoor commercial cleaning), Viabot (outdoor cleaning) and Somatic (bathroom deep cleaning)."
"There are also various specialized slack groups, meetups, and organizations like [iGEM](https://igem.org/Main_Page) (for synthetic biology) that helps founders connect.","There are also various specialized slack groups, meetups, and organizations like iGEM (for synthetic biology) that helps founders connect.","There are also several specialized slack groups, meetups, and companies like iGEM (for synthetic biology) that help founders connect."
"Like William James, the father of American psychology, said: “_The deepest principle in human nature is the craving to be appreciated._”","Like William James, the father of American psychology, said: “The deepest principle in human nature is the craving to be appreciated.”","""The deepest feature of human nature, according to William James, the father of American psychology, is the desire to be acknowledged."""
"I was chatting with John for an hour when he suddenly whispered into my ear, “_No offense taken, but my name is Paul._” I was ashamed of myself, and I’m almost certain this mistake cost me a big business opportunity, as John — sorry, Paul — was the perfect prospect for my business.","I was chatting with John for an hour when he suddenly whispered into my ear, “No offense taken, but my name is Paul.” I was ashamed of myself, and I’m almost certain this mistake cost me a big business opportunity, as John — sorry, Paul — was the perfect prospect for my business.","As John — sorry, Paul — was the right idea for my company when he suddenly whispered into my ear, ""No offense taken, but my name is Paul."""
"I read that, over the course of his life, David Rockefeller (former Chase CEO) wrote about 200,000 notecards to [document his interactions](https://www.wsj.com/articles/david-rockefellers-famous-rolodex-is-astonishing-heres-a-first-peek-1512494592) with world leaders.","I read that, over the course of his life, David Rockefeller (former Chase CEO) wrote about 200,000 notecards to document his interactions with world leaders.","I discovered that David Rockefeller (former Chase CEO) wrote about 200,000 notecards to chronicle his interactions with world leaders over the course of his life."
I needed to write “_see additional notes at the end of the notebook_” — not ideal.,I needed to write “see additional notes at the end of the notebook” — not ideal.,"To write ""see additional notes at the end of the notebook,"" I had to write ""not optimal."""
"• **Take notes during or immediately after meetings.** If the former, be sure to ask the individual if they mind if you jot down a few things during your discussion.","• Take notes during or immediately after meetings. If the former, be sure to ask the individual if they mind if you jot down a few things during your discussion.",• Take notes during or right after meetings to see if they mind if you jot down a few items during your discussion.
"• **Create a to-do list, and set reminders.** This way, you don’t lose track of important dates and opportunities to reach out.","• Create a to-do list, and set reminders. This way, you don’t lose track of important dates and opportunities to reach out.",• Make a to-do list and set reminders so you don't miss out on important dates and opportunities to reach out.
"• **Pay close attention to little details.** Maybe it’s something like, “I’ll have to leave in 15 minutes because tonight is my son’s graduation” or “Next weekend, my husband and I will visit Yosemite.” This information can serve as the perfect ice-breaker the next time you meet.","• Pay close attention to little details. Maybe it’s something like, “I’ll have to leave in 15 minutes because tonight is my son’s graduation” or “Next weekend, my husband and I will visit Yosemite.” This information can serve as the perfect ice-breaker the next time you meet.","• Pay close attention to the little details. Perhaps it's something like, ""I'll have to leave in 15 minutes because tonight is my son's graduation"" or ""My husband and I will visit Yosemite next weekend."""
"• **Before each meeting, check your notes and social media.** LinkedIn and Twitter, in particular, are very valuable sources of information that can help you stay up to date with each of your professional relationships.","• Before each meeting, check your notes and social media. LinkedIn and Twitter, in particular, are very valuable sources of information that can help you stay up to date with each of your professional relationships.",• Check your notes and social media pages ahead of each meeting to ensure that you're up to date with all of your professional contacts.
• **Follow up.** Be proactive and reach out.,• Follow up. Be proactive and reach out.,Follow up: Be proactive and reach out.
"**Tell me in the comment section how _YOU_ are organized, I’m really interested.**","Tell me in the comment section how YOU are organized, I’m really interested.",I'm really interested in knowing how YOU are organized in the comment section.
[React hooks](https://reactjs.org/docs/hooks-intro.html) have been introduced in React 16.8.,React hooks have been introduced in React 16.8.,"In React 16.8, react hooks were introduced."
"There are some prebuilt hooks (`[useState](https://reactjs.org/docs/hooks-state.html)` and `[useEffect](https://reactjs.org/docs/hooks-effect.html)` are probably the most prominent ones), that **can be easily used in hooks built in a custom way for projects**, and a custom hook is just another function that might reuse existing hooks.","There are some prebuilt hooks ([useState](https://reactjs.org/docs/hooks-state.html) and [useEffect](https://reactjs.org/docs/hooks-effect.html) are probably the most prominent ones), that can be easily used in hooks built in a custom way for projects, and a custom hook is just another function that might reuse existing hooks.","There are some pre-built hooks (https://reactjs.org/docs/hooks.html) and [useEffect] are two of the most common ones], and a custom hook is just another way to reuse existing hooks."
"This `useStateWithDouble` hook returns not only the value itself and a function to set it, but also the doubled value, which could then be easily used in a React component.","This useStateWithDouble hook returns not only the value itself and a function to set it, but also the doubled value, which could then be easily used in a React component.","The value itself and a function to set it is returned, but also the doubled value, which can then be used in a React component."
"There is no real limit on what can be done within such a custom hook, it is also possible to mix many different calls to the `useState`, `useEffect`, and all the other hooks, a custom hook can even reuse another custom hook.","There is no real limit on what can be done within such a custom hook, it is also possible to mix many different calls to the useState, useEffect, and all the other hooks, a custom hook can even reuse another custom hook.","There is no real limit to what can be achieved within a custom hook, and it's also possible to mix many different calls to the useState, useEffect, and all other hooks. A custom hook can even reuse another custom hook."
Another thing I like is the idea of the `useEffect` hook (although I think hooks are not absolutely necessary for that idea).,Another thing I like is the idea of the useEffect hook (although I think hooks are not absolutely necessary for that idea).,The useEffect hook hook is another thing I like (although I think hooks are not strictly necessary for this purpose).
Previously [lifecycle methods](https://reactjs.org/docs/state-and-lifecycle.html#adding-lifecycle-methods-to-a-class) had to be used instead.,Previously lifecycle methods had to be used instead.,Previously lifecycle techniques had to be used instead.
"if a component that counts the elapsed seconds was developed, then a `setInterval` was started when the component mounted and `clearInterval` was called when the component was unmounted.","if a component that counts the elapsed seconds was developed, then a setInterval was started when the component mounted and clearInterval was called when the component was unmounted.","If a time period was set, a setInterval was initiated when the component was unmounted, and clearInterval was called when the component was unmounted."
This is exactly what the `componentDidMount` and `componentWillUnmount` functions in the code below are doing.,This is exactly what the componentDidMount and componentWillUnmount functions in the code below are doing.,This is exactly what the componentDidMount and componentWillUnmount functions in the code below are doing.
"The code for the interval is split among these two lifecycle functions, which is already bad enough, but it gets even worse when there is more than one piece of code that needs a setup like this because then the `componentDidMount` and `componentWillUnmount` functions do not follow the [single responsibility principle](https://en.wikipedia.org/wiki/Single-responsibility_principle) anymore.","The code for the interval is split among these two lifecycle functions, which is already bad enough, but it gets even worse when there is more than one piece of code that needs a setup like this because then the componentDidMount and componentWillUnmount functions do not follow the single responsibility principle anymore.","Within these two lifecycle applications, the code for the interval is split, but it gets even worse if there is more than one piece of code that needs to be configured as such because then the componentDidMount and componentWillUnmount functions no longer follow the single responsibility model."
The same code can be implemented a lot cleaner using the `useEffect` hook.,The same code can be implemented a lot cleaner using the useEffect hook.,"Using the useEffect hook, the same code can be made a lot faster."
"This way the code that belongs together also is also colocated in the source, like the `setInterval` and `clearInterval` calls in the code below.","This way the code that belongs together also is also colocated in the source, like the setInterval and clearInterval calls in the code below.","paracode below, which code that belongs to multiple places is also colocated in the source, such as the setInterval and clearInterval calls."
"There are workarounds for some of these issues, but they **make some concepts hard to explain**, and in my opinion, this is a sign that not everything is solved in the best possible way, and that there might be some underlying issues.","There are workarounds for some of these issues, but they make some concepts hard to explain, and in my opinion, this is a sign that not everything is solved in the best possible way, and that there might be some underlying issues.","While there are workarounds for some of these problems, some of them are difficult to explain, and in my opinion, this is a sign that not everything is resolved in the right way and that there may be some underlying causes."
"Sure, there are some issues with classes in JavaScript, the most prominent example is the [**binding of**](https://web.dev/javascript-this/) `[**this**](https://web.dev/javascript-this/)`**, which sometimes behaves differently than in other object-oriented languages**.","Sure, there are some issues with classes in JavaScript, the most prominent example is the binding of [**this**](https://web.dev/javascript-this/), which sometimes behaves differently than in other object-oriented languages.","Sure, JavaScript classes have their limitations, but the binding of [**this**] (https://web.dev/javascript-this/), which is the most common example. JavaScript's binding is also used in other object-oriented languages."
"But using [class properties](https://babeljs.io/docs/en/babel-plugin-proposal-class-properties) worked quite well, so this is not really an argument for me.","But using class properties worked quite well, so this is not really an argument for me.","However, class properties worked well, so this is not really an argument for me."
"But most importantly, this decision **broke a very important invariant of functions, namely that a function will return the same value if the same input parameters are passed**.","But most importantly, this decision broke a very important invariant of functions, namely that a function will return the same value if the same input parameters are passed.","However, the decision was made in violation of a very important function, namely that a function will return the same value if the same input parameters were entered."
The main reason for that is the `useState` hook.,The main reason for that is the useState hook.,The useState hook is the primary reason for this.
"Whenever the `button` has to be rerendered, the function is executed again.","Whenever the button has to be rerendered, the function is executed again.","If the button has to be rerendered, the procedure is repeated."
