source_with_markdown,source_without_markdown,target_without_markdown
"`useState` introduces some side effects, something that has been frowned upon, especially in functional programming, because it makes hunting bugs harder.","useState introduces some side effects, something that has been frowned upon, especially in functional programming, because it makes hunting bugs harder.","UseState has some side effects, something that has been largely rejected in functional programming because it makes hunting bugs more difficult."
So **I think that stuff having an internal state should be modeled using classes and objects instead of functions.**,So I think that stuff having an internal state should be modeled using classes and objects instead of functions.,"So, I believe that stuff with an internal state should be modelled using classes and objects rather than functions."
"Additionally, there are many hooks like `useState`, `useRef`, or `useMemo` that seem to replicate the behavior that would be quite easy to be implemented in classes, which makes this decision even less understandable for me.","Additionally, there are many hooks like useState, useRef, or useMemo that seem to replicate the behavior that would be quite easy to be implemented in classes, which makes this decision even less understandable for me.","In addition, there are several hooks like useState, useRef, or useMemo that seem to be similar to classroom teaching, which makes this decision even more difficult for me."
"Another issue is that hooks avoid the `this` keyword, but introduce another problem called staleness.","Another issue is that hooks avoid the this keyword, but introduce another problem called staleness.","Hooks avoid the word ""staleness,"" another issue is introduced."
"The issue is that the `seconds` variable in the `useEffect` hook will always be taken from the first render, where `seconds` was set to `0` because this is [how closures work](https://developer.mozilla.org/en-US/docs/Web/JavaScript/Closures).","The issue is that the seconds variable in the useEffect hook will always be taken from the first render, where seconds was set to 0 because this is how closures work.","The issue is that the seconds variable in the useEffect hook will always be taken from the first render, where seconds were set to 0 because this is how closures work."
"Therefore the `setSeconds` called every second will always calculate `0 + 1` and assign 1 to the state, causing the seconds to hang from an end-user perspective.","Therefore the setSeconds called every second will always calculate 0 + 1 and assign 1 to the state, causing the seconds to hang from an end-user perspective.","Since the seconds were set from an end-user perspective, the setSeconds called every second will always calculate 0 + 1 and assign 1 to the state."
"This issue can be fixed by passing a function to `setSeconds`, which will retrieve the current value as an argument.","This issue can be fixed by passing a function to setSeconds, which will retrieve the current value as an argument.","This issue can be resolved by passing a function to setSeconds, which will return the current value as an argument."
"So the problem with `this` was fixed by replacing it with another one; instead of having to know how classes and the `this` keyword work, developers have to know how closures work, and they can lead to even sneakier bugs in my opinion.","So the problem with this was fixed by replacing it with another one; instead of having to know how classes and the this keyword work, developers have to know how closures work, and they can lead to even sneakier bugs in my opinion.","So the issue with this was solved by swapping it with another one; rather than having to figure out how classes and the keywords work, developers must know how closures work, and that can result in even more sneaky bugs."
"If `this` is accidentally bound to a wrong value for whatever reason, then there will be an error in the developer console.","If this is accidentally bound to a wrong value for whatever reason, then there will be an error in the developer console.","If this is mistakenly linked to the wrong value for whatever reason, there will be an error in the developer console."
"the `useState` hook is a bit weird (probably even the React team themselves, since [they devoted an own section in the documentation for it](https://reactjs.org/docs/hooks-state.html#tip-what-do-square-brackets-mean)).","the useState hook is a bit weird (probably even the React team themselves, since they devoted an own section in the documentation for it).","The useState hook is a little strange (probably even the React team itself, since they dedicated their own section to it)."
The `useState` call in the above code makes use of array destructuring.,The useState call in the above code makes use of array destructuring.,array destructuring is used in the above code by the useState function.
"When the function is re-executed, the `useState` hook will return a different value for `count`, but in a new function execution.","When the function is re-executed, the useState hook will return a different value for count, but in a new function execution.","The useState hook will return a different number for count when the procedure is re-executed, but not in a new function execution."
"Therefore the `count` variable can have a different value on each execution, although it is defined as `const`.","Therefore the count variable can have a different value on each execution, although it is defined as const.","Therefore, the count variable can have a different value on each execution, although const."
**This decision has been made to allow the variables however you wish because they are assigned by their position.** The `useState` hook itself does not name that at all.,This decision has been made to allow the variables however you wish because they are assigned by their position. The useState hook itself does not name that at all.,"Since the variables are assigned by their position, the useState hook does not specify that."
"**The below code might be more verbose, but I think it is easier to understand what is happening.**","The below code might be more verbose, but I think it is easier to understand what is happening.","The below code may be longer, but I think it's much easier to figure out what's going on."
"Even though `useEffect` is probably my favorite hook, it has still a rather strange syntax, which makes it not that easy to explain.","Even though useEffect is probably my favorite hook, it has still a rather strange syntax, which makes it not that easy to explain.","Even though useEffect is my most popular hook, it also has a rather odd syntax, which makes it difficult to comprehend."
"The old lifecycle functions had their fair share of problems, for which reason I think it is a step forward, **but having methods on a class called** `**componentDidMount**`**,** `**componentWillUmount**`**, etc.","The old lifecycle functions had their fair share of problems, for which reason I think it is a step forward, but having methods on a class called **componentDidMount**, **componentWillUmount****, etc.","The old lifecycle had their fair share of issues, for which I think it's a step forward, but it does have methods on a class called **componentDidMount**, **componentWillUmount****, etc."
"Another thing that bothers me is that the `useEffect` hook is always taken as an example of why hooks are better than classes, but I think that is mixing two different things.","Another thing that bothers me is that the useEffect hook is always taken as an example of why hooks are better than classes, but I think that is mixing two different things.","The useEffect hook is always used as an example of why hooks are better than classes, but I suspect that is mixing two different things."
"**The idea of effects is great, but they should be seen decoupled from hooks.** I think effects could have also been implemented using classes in one or the other way.","The idea of effects is great, but they should be seen decoupled from hooks. I think effects could have also been implemented using classes in one or the other way.","The idea of effects is exciting, but they should have been seen decoupled from hooks in one or the other way."
"The other thing is that some hooks force developers to generate even more code, which might cause performance to be worse, even for hooks like `useMemo` and `useCallback` that are actually made for improving performance.","The other thing is that some hooks force developers to generate even more code, which might cause performance to be worse, even for hooks like useMemo and useCallback that are actually made for improving performance.","The other thing is that some hooks force developers to write even more code, which may lead to even worse results, even for hooks like useMo and useCallback, which are actually intended to improve performance."
"Dodds has written another blog post about this.](https://kentcdodds.com/blog/usememo-and-usecallback) **The main takeaway is that when using** `**useCallback**` **or** `**useMemo**` **there is already another function call and array definition, and the performance win has to outweigh this additional work.**","Dodds has written another blog post about this.](https://kentcdodds.com/blog/usememo-and-usecallback) The main takeaway is that when using **useCallback** or **useMemo** there is already another function call and array definition, and the performance win has to outweigh this additional work.","Dodds has written another blog post about this. (https://kentcdodds.com/usememo/usecallback) The main takeaway is that when using **useCallback** or **useMemo** there is already another function call and array definition, and the result must outweigh this additional effort."
"When developing classes this is more or less already solved, at least apart from a few possible confusing scenarios regarding the `this` keyword.","When developing classes this is more or less already solved, at least apart from a few possible confusing scenarios regarding the this keyword.","This is more or less solved when teaching classes, at least in comparison to a few potential confusing scenarios regarding the keyword."
"Summed up I can agree with the fact, that there are some advantages with hooks, especially with `useEffect`.","Summed up I can agree with the fact, that there are some advantages with hooks, especially with useEffect.","Summed up: I can admit that hooks have some benefits, particularly with useEffect."
"But especially the `useEffect` hook could probably also be implemented using classes, at least in theory.","But especially the useEffect hook could probably also be implemented using classes, at least in theory.","However, the useEffect hook could possibly be used with classes, at least in theory."
"These thoughts are coming off the top of my head, if you agree/disagree or have other issues with hooks please let me know on [Twitter](https://twitter.com/search?q=https://danielrotter.at/2022/01/16/some-reasons-for-disliking-react-hooks.html)!","These thoughts are coming off the top of my head, if you agree/disagree or have other issues with hooks please let me know on Twitter!","These thoughts are coming off the top of my head, if you agree/disagree or have other issues with hooks, please let me know on Twitter!"
_Isn’t that shocking?!_,Isn’t that shocking?!,Isn't that surprising?
He was **_20_** but looked like my 16 years old brother that started shaving barely last year.,He was 20 but looked like my 16 years old brother that started shaving barely last year.,"He was 20 years old, but it seemed like his 16-year-old brother who started shaving just last year."
So I couldn’t resist and asked a couple of **_personal questions_**.,So I couldn’t resist and asked a couple of personal questions.,I couldn't resist and asked a few questions about myself.
Answers were _honest and inspiring_.,Answers were honest and inspiring.,The answers were honest and encouraging.
He started coding in his early **_16_**.,He started coding in his early 16.,He began coding in his early teen years.
"At that moment, he has been working as a freelancer for **_3 years_** already.","At that moment, he has been working as a freelancer for 3 years already.",He has been working as a freelancer for three years now.
[Is he just trying to fool me with his expertise?](https://medium.com/codex/the-best-part-of-effective-technical-interview-82f2d206c0ef) Maybe it was someone’s joke?,Is he just trying to fool me with his expertise? Maybe it was someone’s joke?,Is he just trying to fool me with his knowledge? Maybe it was someone's prank?
I tried to find at least some of the [red flags](https://medium.com/codex/4-red-flags-of-terrible-developer-6cb9ef117576) of [terrible developer](https://medium.com/codex/4-more-red-flags-of-terrible-developer-23ca25212d52) or even lie.,I tried to find at least some of the red flags of terrible developer or even lie.,I tried to locate at least some of the red flags of a bad developer or even lie.
His expertise and **_practical_** skills were excellent!,His expertise and practical skills were excellent!,His knowledge and practical skills were outstanding!
My second try was to catch him in the **_theory_** field.,My second try was to catch him in the theory field.,My second attempt was to catch him in the theory field.
**_YouTube and articles_** on the internet — was the simple answer.,YouTube and articles on the internet — was the simple answer.,Was the straightforward answer on YouTube and articles on the internet.
The last check required was [live coding](https://medium.com/codex/the-best-part-of-effective-technical-interview-82f2d206c0ef).,The last check required was live coding.,Live coding was used for the last check.
I recommended him for the **_Senior Software Engineer_** position.,I recommended him for the Senior Software Engineer position.,I've been recommending him for the Senior Software Engineer position.
The only thing that matters is your **_skills and expertise._**,The only thing that matters is your skills and expertise.,Your abilities and experience are the only thing that matters.
Everyone is chasing **_value_**.,Everyone is chasing value.,Everyone is looking for value.
_So beware!_,So beware!,So beware!
"If you liked this thing,_ [_follow me_](https://deniard.medium.com/) _and clap a couple of times.","If you liked this thing,_ follow me _and clap a couple of times.",Follow me _and clap a few times if you liked this stuff.
"_Also, you can support me directly with your fee by joining Medium through my_ [_affiliate link._](https://medium.com/@deniard/membership) _It helps a lot!_","Also, you can support me directly with your fee by joining Medium through my affiliate link. It helps a lot!","In addition, you can help me with your fee by joining Medium via my affiliate link, which helps a lot!"
"When multi-hyphenate performer Childish Gambino released his visual for “[This Is America](https://www.google.com/search?gs_ssp=eJzj4tVP1zc0TM9IS0spNjc3YPRSSM7IzEnJLM5QSE_MTcrMy1coycgsVgCixNzUoszkRACN_xDF&q=childish+gambino+this+is+america&oq=childish+&aqs=chrome.5.0i355i433i512j46i433i512j69i57j0i433i512l2j46i512j46i433i512j46i131i433i512j0i512l2.6728j0j7&sourceid=chrome&ie=UTF-8)” in 2018, it sent shockwaves through the Twitterverse and beyond.","When multi-hyphenate performer Childish Gambino released his visual for “This Is America” in 2018, it sent shockwaves through the Twitterverse and beyond.","Childish Gambino, a multi-hyphenate performer, brought shockwaves throughout the Twitterverse and elsewhere when it was announced in 2018."
"Hours after being honorably discharged from the United States Army after fighting for his country in World War II, [Officer Issac Woodard](https://www.navytimes.com/news/your-navy/2019/11/09/the-blinding-of-a-wwii-vet-opened-americas-eyes-to-the-evil-of-jim-crow/) suffered a brutal attack at the hands of South Carolina police as they pulled him off a bus and beat him, leaving him blind.","Hours after being honorably discharged from the United States Army after fighting for his country in World War II, Officer Issac Woodard suffered a brutal attack at the hands of South Carolina police as they pulled him off a bus and beat him, leaving him blind.","Officer Issac Woodard was brutally discharged from the United States Army after serving for his country in World War II, leaving him blind."
"Allison Wonchoba uses author James Clear’s 1% rule (from his book, _Atomic Habits_) to remind us that even a tiny amount of progress every day adds up to a huge difference.","Allison Wonchoba uses author James Clear’s 1% rule (from his book, Atomic Habits) to remind us that even a tiny amount of progress every day adds up to a huge difference.",Author James Clear's 1% rule (from his book Atomic Habits) reminds us that even a small amount of progress every day makes a huge difference.
"There’s a reason Nir Eyal’s books _Hooked_ and _Indistractable_, on maintaining one’s focus in a world full of increasingly more (and more powerful) distractions, became bestsellers.","There’s a reason Nir Eyal’s books Hooked and Indistractable, on maintaining one’s focus in a world full of increasingly more (and more powerful) distractions, became bestsellers.","For a reason, Nir Eyal's books Hooked and Indistractable, on retaining one's attention in a world full of increasingly more (and more popular) distractions, became bestsellers."
[Taking a break can](https://www.nirandfar.com/how-to-spend-your-breaks-wisely-and-have-a-better-workday/) be good for you.,Taking a break can be good for you.,Taking a break can be helpful to you.
"When I read this piece by [Erik Ruof](https://eruof.medium.com/), I was immediately transported to a past life where I helped run corporate conferences.","When I read this piece by Erik Ruof, I was immediately transported to a past life where I helped run corporate conferences.","I was immediately transported to Erik Ruof's article, where I had worked in corporate meetings."
"For one productivity conference, I was made to send dozens of shower crayons (those [kids drawing tools](https://parentingchaos.com/homemade-bath-crayons/) meant to make bathing fun and to [encourage writing on walls](https://twitter.com/DrMassicotte/status/930225763638317058)) to the event.","For one productivity conference, I was made to send dozens of shower crayons (those kids drawing tools meant to make bathing fun and to encourage writing on walls) to the event.",I was invited to bring hundreds of shower crayons (those kids drawing devices meant to make bathing fun and encourage writing on walls) to the event for one productivity conference.
"Like Ruof, without the chance for my mind to wander — to give it space from the endless scroll of distracting blue light emitting think pieces about [_Mare of Easttown_’s hair](https://www.indiewire.com/2021/05/mare-of-easttown-characters-bed-hair-1234636363/) — the subconscious trickles of inspiration are unable to flow.","Like Ruof, without the chance for my mind to wander — to give it space from the endless scroll of distracting blue light emitting think pieces about Mare of Easttown’s hair — the subconscious trickles of inspiration are unable to flow.","The subconscious hints of inspiration are unable to flow in Ruof, without the opportunity for my mind to wander."
"Also, Ruof made me really think hard about [Koopalings](https://mario.fandom.com/wiki/Koopalings) and, to answer his mind-wandering question that turned into my hour long distraction.","Also, Ruof made me really think hard about Koopalings and, to answer his mind-wandering question that turned into my hour long distraction.","In addition, Ruof made me really think about Koopalings and, eventually, to answer his mind-wandering question that became my hour long distraction."
"I think [Bowser](https://www.mariowiki.com/Bowser) is part turtle/dragon/reptile so maybe one, er, encounter could produce/hatch [many, many children](https://www.turtleconservationsociety.org.my/how-many-eggs-does-a-turtle-lay-at-a-time/)?","I think Bowser is part turtle/dragon/reptile so maybe one, er, encounter could produce/hatch many, many children?","Bowser is thought to be a species of turtle/dragon/reptile, so perhaps one, er, encounter could produce/hatch many children."
"I imagine it’s the same for many creators — one minute you’re in a “[flow state](https://medium.com/personal-growth-lab/how-to-reach-flow-state-using-10-flow-state-triggers-473aa28dc3e5)” and the next minute, you’ve unconsciously picked up your phone and are scrolling Instagram or Facebook without even realizing it.","I imagine it’s the same for many creators — one minute you’re in a “flow state” and the next minute, you’ve unconsciously picked up your phone and are scrolling Instagram or Facebook without even realizing it.","One minute you're in a ""flow state,"" and the next minute, you've unconsciously picked up your phone and scrolled Instagram or Facebook without even knowing it."
"It’s easy to blame the myriad distractions that compete for our attention — social media, Netflix, the news (the _New York Times_ is my biggest “[unconscious refresh](https://zulie.medium.com/how-to-stop-yourself-from-constantly-checking-your-notifications-dc0038f2b9f2)” site!).","It’s easy to blame the myriad distractions that compete for our attention — social media, Netflix, the news (the New York Times is my biggest “unconscious refresh” site!).","It's simple to blame the numerous distractions that vie for our attention — social media, Netflix, and the news — (the New York Times is my most popular ""unconscious refresh"" page!"
"There are many takes on [creative productivity](https://skooloflife.medium.com/21-keys-to-creative-productivity-7b04cc01996e) right here on Medium, but what stood out to me most about [Darrow’s piece](https://medium.com/swlh/the-only-source-of-distractions-creators-should-worry-about-3e610162d54d) is the idea that distraction isn’t coming from an external source, like our phones, or TVs, but rather, an internal one — right inside our own minds.","There are many takes on creative productivity right here on Medium, but what stood out to me most about Darrow’s piece is the idea that distraction isn’t coming from an external source, like our phones, or TVs, but rather, an internal one — right inside our own minds.","There are many interpretations of creative productivity on Medium, but the argument that distracted was not coming from an external source, like our phones or TVs, but rather, an internal one — right inside our own minds."
"Darius Foroux is a master of [staying in the present](https://medium.com/darius-foroux/on-living-a-conscious-life-e07a05505e66), but that doesn’t mean that it comes easy even to him.","Darius Foroux is a master of staying in the present, but that doesn’t mean that it comes easy even to him.","Darius Foroux is a master of staying in the present, but that doesn't mean that it comes easy for him."
"In an [article](http://www.alternet.org/story/154518/why_we_have_to_go_back_to_a_40-hour_work_week_to_keep_our_sanity?paging=off&current_page=1#bookmark) for AlterNet, editor Sara Robinson referenced research conducted by the US military which revealed that [“losing just one hour of sleep per night for a week will cause a level of cognitive degradation equivalent to a .10 blood alcohol level.”](http://clicktotweet.com/P8l8f) You can get fired for coming to work drunk, but it’s acceptable to pull an all-nighter.","In an article for AlterNet, editor Sara Robinson referenced research conducted by the US military which revealed that “losing just one hour of sleep per night for a week will cause a level of cognitive degradation equivalent to a .10 blood alcohol level.” You can get fired for coming to work drunk, but it’s acceptable to pull an all-nighter.","Editor Sara Robinson referred to studies published by the US military that showed that ""losing just one hour of sleep per week for a week will result in cognitive decline equivalent to a.10 blood alcohol level."" You can be fired for going to work in a week of alcohol abuse, but it is also acceptable to pull an all-nighter."
"[(James Maas, a sleep researcher and expert, revealed that at least seven out of every 10 Americans don’t get enough sleep.)](https://experiencelife.com/article/the-healing-power-of-sleep/)","(James Maas, a sleep researcher and expert, revealed that at least seven out of every 10 Americans don’t get enough sleep.)","(James Maas, a sleep researcher and specialist, reported that at least seven out of every ten Americans don't get enough sleep.)"
* Leonardo da Vinci took multiple naps a day and slept less at night.,Leonardo da Vinci took multiple naps a day and slept less at night.,Leonardo da Vinci took multiple naps a day and slept less at night.
"* Though Thomas Edison was embarrassed about his napping habit, he also practiced this ritual on a daily basis.","Though Thomas Edison was embarrassed about his napping habit, he also practiced this ritual on a daily basis.","Though Thomas Edison was embarrassed about his napping habits, he followed this tradition on a daily basis."
"* Gene Autry, “the Singing Cowboy,” routinely took naps in his dressing room between performances.","Gene Autry, “the Singing Cowboy,” routinely took naps in his dressing room between performances.","Gene Autry, ""the Singing Cowboy,"" took naps in his dressing room between performances."
* Winston Churchill’s afternoon nap was a non-negotiable.,Winston Churchill’s afternoon nap was a non-negotiable.,Winston Churchill's afternoon nap was a non-negotiable.
