source_with_markdown,source_without_markdown,target_without_markdown
"**One Minute Goal Setting**: Outlining with the employee specific goals, benchmarks and consequences (good and bad).","One Minute Goal Setting: Outlining with the employee specific goals, benchmarks and consequences (good and bad).","One Minute Goal Setting: Outlining with the employee's specific goals, benchmarks, and repercussions (good and bad)."
"**One Minute Praisings**: Catching someone doing something right, and recognizing them for it.","One Minute Praisings: Catching someone doing something right, and recognizing them for it.",One Minute Praising: Catching someone doing something right and congratulating them for it.
"**One Minute Reprimands**: Catching unproductive or negative behavior immediately, and explaining to the employee what the consequences have been.","One Minute Reprimands: Catching unproductive or negative behavior immediately, and explaining to the employee what the consequences have been.",One Minute Reprimands: catching unproductive or negative conduct right away and alerting the employee what the employee's repercussions were.
"**\[Warning: this is going to get extremely practical.** There are other ways of finding team members, but this is one way I have found that works.\]","[Warning: this is going to get extremely practical. There are other ways of finding team members, but this is one way I have found that works.]","Warning: this is going to be very useful. There are other ways to locate team members, but this is one way I have found that works.)"
Buy a domain (I use [GoDaddy](https://www.godaddy.com/)) for your idea and set up a landing page using a simple website builder (I use [Instapage)](http://instapg.es/cdPs7) and pitch your idea as you would if you were trying to make real sales or get downloads from the public customer.,Buy a domain (I use GoDaddy) for your idea and set up a landing page using a simple website builder (I use Instapage) and pitch your idea as you would if you were trying to make real sales or get downloads from the public customer.,Purchase a domain name (I use GoDaddy) for your idea and build a landing page with a basic website builder (I use Instapage) and pitch your proposal as you would if you were trying to make real sales or get downloads from the public customer.
Build the landing page with an email capture [call-to-action](http://www.wordstream.com/blog/ws/2015/02/20/call-to-action-buttons) at the bottom.,Build the landing page with an email capture call-to-action at the bottom.,"At the bottom, build the landing page with an email capture call-to-action."
"Once you build a landing page, and it looks great (Read: [How to make a great landing page with crazy high conversions](http://www.wordstream.com/blog/ws/2014/02/12/great-landing-pages)), share on your social networks.","Once you build a landing page, and it looks great (Read: How to make a great landing page with crazy high conversions), share on your social networks.",Once you've developed a landing page and it looks fantastic (Read: How to make a great landing page with high conversions) post it on your social media pages.
"Also, use [Reddit](https://www.reddit.com/), “the front page of the Internet” social news website, especially the subreddits [/r/entrepreneur](https://www.reddit.com/r/Entrepreneur/) and [/r/startups](https://www.reddit.com/r/startups/).","Also, use Reddit, “the front page of the Internet” social news website, especially the subreddits /r/entrepreneur and /r/startups.","Also, use Reddit, ""the front page of the Internet,"" especially the subpoena and /r/startups."
Reddit has been an incredible source of objective feedback and traffic for [many startups](http://opportunitylives.com/college-startup-seeks-to-revolutionize-1-5-billion-peanut-butter-industry/).,Reddit has been an incredible source of objective feedback and traffic for many startups.,"For several startups, Reddit has been an excellent source of objective feedback and traffic."
"Also, write a post on [Medium](https://medium.com/), an emerging publishing platform for new ideas.","Also, write a post on Medium, an emerging publishing platform for new ideas.","In addition, write a blog on Medium, a new publishing platform for new ideas."
Experiment more with your landing page (this is called [A/B testing](https://vwo.com/ab-testing/)).,Experiment more with your landing page (this is called A/B testing).,Experiment with your landing page will increase (this is called A/B testing).
"Then, set up a free [Slack](https://slack.com/) community.","Then, set up a free Slack community.","Then, established a free Slack group."
"Within Slack, [set up channels](https://slack.zendesk.com/hc/en-us/articles/201402297-Creating-a-channel) where you can focus conversations and brainstorm on specific topics such as #Design, #Marketing, and #Development.","Within Slack, set up channels where you can focus conversations and brainstorm on specific topics such as #Design, #Marketing, and #Development.","Set up channels within Slack where you can focus on specific topics such as #Design, #Marketing, and #Development."
"But seeing that [working remotely is becoming more and more the working norm](http://www.wsj.com/articles/SB10001424127887324539404578342503214110478), I am a lot better off than building a business idea secretively inside my own head.","But seeing that working remotely is becoming more and more the working norm, I am a lot better off than building a business idea secretively inside my own head.","However, seeing that working remotely is becoming more popular, I am a lot better off than constructing a company model from scratch."
[Brew](http://www.brewapp.io) is a mobile journal app that connects entrepreneurs (business brewers) over coffee and beer.,Brew is a mobile journal app that connects entrepreneurs (business brewers) over coffee and beer.,Brew is a smartphone journal app that brings entrepreneurs (business brewers) together over coffee and beer.
* Jobs-to-be-done defines the purpose of buying and hence aids innovation.,Jobs-to-be-done defines the purpose of buying and hence aids innovation.,The object of buying and therefore assisting in innovation is defined by jobs-to-be-done.
* Jobs-to-be-done relates not just to the offer but also all user experience elements.,Jobs-to-be-done relates not just to the offer but also all user experience elements.,Not only does the product but also all user experience aspects must be considered.
"If you found this post insightful, sign up for my newsletter and get your free [‘Innovation Level Up Guide — 7 tools to boost your project.’](https://jncnova.com/join-jnc-nova-mailing-list-2/)","If you found this post insightful, sign up for my newsletter and get your free ‘Innovation Level Up Guide — 7 tools to boost your project.’","If you found this article helpful, sign up for my newsletter and get your free 'Innovation Level Up Guide — 7 tips to improve your project.'"
"According to [Crunchbase](https://news.crunchbase.com/news/seed-funding-startups-top-vc-firms-a16z-nea-khosla/), the average seed round now raises close to $5M.","According to Crunchbase, the average seed round now raises close to $5M.","According to Crunchbase, the average seed round now raises close to $5 million."
Even a pre-seed round now has an average valuation [nearing $10M](https://www.angellist.com/blog/the-state-of-us-early-stage-venture-and-startups-3q21).,Even a pre-seed round now has an average valuation nearing $10M.,And a pre-seed round now has an average valuation of over $10 million.
The biggest dividing line for startups is between _pre-revenue_ and _in-revenue_.,The biggest dividing line for startups is between pre-revenue and in-revenue.,The most notable dividing line for startups is between pre-revenue and in-revenue.
It takes time to become a [multiple income stream badass](https://medium.com/swlh/passive-income-badasses-do-these-things-680cf18b4ba4).,It takes time to become a multiple income stream badass.,It takes time to become a multiple income stream blighter.
"One of the biggest bloggers on the internet, Benjamin Hardy, swears by [online courses](https://medium.com/entrepreneur-s-handbook/ive-launched-many-successful-online-courses-here-are-the-tools-i-used-to-make-6-figures-c53c0401435b) as a key income stream.","One of the biggest bloggers on the internet, Benjamin Hardy, swears by online courses as a key income stream.","Benjamin Hardy, one of the internet's most popular bloggers, swears by online courses as a primary income source."
[I love eBooks as an income stream.](https://medium.com/better-marketing/what-i-learned-from-writing-an-ebook-in-under-30-days-and-selling-it-for-19-95-81483e856d0b),I love eBooks as an income stream.,"As an income source, I love eBooks."
**Blueprint:** Go where people are online.,Blueprint: Go where people are online.,Blueprint: Go where people are online.
"Think Vocal, [Substack](https://medium.com/entrepreneur-s-handbook/you-can-make-a-lot-of-money-with-a-substack-newsletter-6c4f0c4cb166), [Quora](https://medium.com/writing-cooperative/my-writing-experiment-on-quora-the-incredible-the-bad-the-eye-opening-4d80d4c32b11).","Think Vocal, Substack, Quora.","Consider Vocal, Substack, Quora."
**Mantra:** two steps ahead is all I need to be.,Mantra: two steps ahead is all I need to be.,I need to be in two steps ahead.
**Easy hack:** direct message business owners on [LinkedIn](https://medium.com/writing-cooperative/your-writing-can-go-viral-regularly-with-only-200-words-35c369196c49).,Easy hack: direct message business owners on LinkedIn.,"On LinkedIn, a simple hacker can quickly notify company owners."
**Takeaway:** add one Web3 income source to be ahead of the curve and access the exponential financial opportunities.,Takeaway: add one Web3 income source to be ahead of the curve and access the exponential financial opportunities.,"Takeaway: To be ahead of the curve and see the exponential financial opportunities, you should have one Web3 income source."
[**Join my email list with 50K+ people for more helpful insights.**](http://timdenning.com/mb/),Join my email list with 50K+ people for more helpful insights.,"For more useful details, join my email list of 50K+ people."
"A[ccording to a study conducted by McKinsey](https://www.theatlantic.com/business/archive/2012/07/re-re-fw-re-workers-spend-650-hours-a-year-on-email/260447/), the average American worker spends 28% of their office day working on email.","According to a study conducted by McKinsey, the average American worker spends 28% of their office day working on email.","According to a McKinsey report, the average American worker spends 28 percent of their office day on email."
"Only, when we dig a little further, [_we can discover that the vast majority of those emails go unread_](https://www.cnbc.com/2017/06/07/the-number-one-mistake-people-make-when-writing-work-emails.html).","Only, when we dig a little further, we can discover that the vast majority of those emails go unread.","Only when we dig a little deeper, we find that the overwhelming majority of those emails went unread."
"[Because as a side hustler](https://medium.com/swlh/a-12-month-hold-your-hand-manual-for-creators-looking-to-increase-their-monthly-income-4d1573c5789d?source=your_stories_page----------------------------------------), you’ve been working your tail off trying to build an extra income.","Because as a side hustler, you’ve been working your tail off trying to build an extra income.",Because you've been working your tail off trying to build an extra income as a side hustler.
And that keeps you in side-hustle _limbo_.,And that keeps you in side-hustle limbo.,And that puts you in a state of hustle.
While there’s a whole universe of problems we can highlight that can help diagnose the lack of progression — **the most common problem is ineffective copywriting.**,While there’s a whole universe of problems we can highlight that can help diagnose the lack of progression — the most common problem is ineffective copywriting.,"Although there is an entire universe of problems we can solve, the most common issue is ineffective copywriting."
"[Most side hustlers know when you talk _to_ the reader](https://medium.com/swlh/there-are-a-million-ways-to-build-a-writing-business-these-6-ways-will-help-you-build-it-faster-74eabc69b3b2?source=your_stories_page----------------------------------------), it helps encourage action.","Most side hustlers know when you talk to the reader, it helps encourage action.","When you talk to the reader, it helps encourage action."
"They incentivize action by reducing the effort needed to absorb the information or [join the list](https://medium.com/swlh/12-months-obsessing-over-tiny-side-income-skills-will-impact-your-life-forever-b9c7ef89d624?source=your_stories_page----------------------------------------), etc.","They incentivize action by reducing the effort needed to absorb the information or join the list, etc.","They encourage change by lowering the effort required to absorb the details or join the list, etc."
"However, ask yourself — _what exactly does being an ""Allstar"" even mean?_","However, ask yourself — what exactly does being an ""Allstar"" even mean?","However, ask yourself: What does being a ""Allstar"" mean?"
"**Creating a curiosity gap is essentially the art of using the headline to give the reader the beginning of the story, the end of the story, and building curiosity as to what came in between.** It can take some real copywriting wizardry to pull it off.","Creating a curiosity gap is essentially the art of using the headline to give the reader the beginning of the story, the end of the story, and building curiosity as to what came in between. It can take some real copywriting wizardry to pull it off.","Creating a curiosity gap is essentially the art of using the headline to tell the reader the beginning of the tale, the conclusion of the tale, and curiosity as to what came in between."
"Now, is that _exactly_ double?","Now, is that exactly double?","Now, is that really double?"
"But hopefully, you won’t _nail me to the cross_ on a rounding error…","But hopefully, you won’t nail me to the cross on a rounding error…","However, I hope you won't nail me to the cross on a rounding blunder."
If you want to excel and earn more than what you’re currently making by doing what you love — regardless of your experience — [check out my guide](https://tribeloyal.com/free-6-step-course/).,If you want to excel and earn more than what you’re currently making by doing what you love — regardless of your experience — check out my guide.,"Whether you're new to doing what you love or not, check out my guide."
